id,name,date,genre,description,backdrop,poster
595813,Barb & Star Go to Vista Del Mar,2021-03-29,Comedy,"The story of best friends Barb and Star, who leave their small midwestern town for the first time to go on vacation in Vista Del Mar, Florida, where they soon find themselves tangled up in adventure, love, and a villain’s evil plot to kill everyone in town.",/mvxR0mbDVQkQp3K1OhEU9iDbGcA.jpg,/8oiV8GtBG7GDJa3ejvxZzJnBgff.jpg
14411,Sinbad: Legend of the Seven Seas,2003-07-02,"Family, Animation, Adventure, Comedy, Fantasy, Action","The sailor of legend is framed by the goddess Eris for the theft of the Book of Peace, and must travel to her realm at the end of the world to retrieve it and save the life of his childhood friend Prince Proteus.",/9seBrjaPfX08LqM1kQVVZ6Xd3Bp.jpg,/CQ1bthSN2uXDxovHUwH8mIB9zy.jpg
565,The Ring,2002-10-18,"Horror, Mystery","It sounded like just another urban legend: A videotape filled with nightmarish images, leading to a phone call foretelling the viewer's death in exactly seven days. As a newspaper reporter, Rachel Keller was naturally skeptical of the story, until four teenagers all met with mysterious deaths exactly one week after watching just such a tape. Allowing her investigative curiosity to get the better of her, Rachel tracks down the video... and watches it. Now she has just seven days to unravel the mystery of the Ring.",/kQOLgJGvFjQ7EwGfaPkW9dlGFXJ.jpg,/gghD2ZIPjMzLnnBuT3AZQGYnIW9.jpg
675319,Zone 414,2021-09-03,"Science Fiction, Thriller, Mystery","In the near future on a colony of state-of-the-art robots, a private investigator is hired by the colony's creator to bring his missing daughter home.",/Aj9yZcNnGmOmOBzKskeffLWk65j.jpg,/wIm5S6Blkb0qDMTGVu80VWSrQV1.jpg
9836,Happy Feet,2006-11-16,"Animation, Comedy, Family","Into the world of the Emperor Penguins, who find their soul mates through song, a penguin is born who cannot sing. But he can tap dance something fierce!",/9DUAR7p4SGqt2ISH2lmSzNx3uni.jpg,/za41IHkj6LnkilfTzv5B2qmthKD.jpg
15016,Barbie of Swan Lake,2003-09-27,"Animation, Family","Barbie as Odette, the young daughter of a baker, follows a unicorn into the Enchanted Forest and is transformed into a swan by an evil wizard intent on defeating the Fairy Queen.",/tonrulTmO9ZyZmsAsr5yr9ciE4c.jpg,/sLpCLVQWTU7BI4yAL6kIFM9J3eX.jpg
1691,Hostel: Part II,2007-06-08,Horror,"Three American college students studying abroad are lured to a Slovakian hostel, and discover the grim reality behind it.",/gtBjAqY6yf5nI4BTgi1BrmOVzQS.jpg,/vUlEHfqfeCy7ojUk6OFtoljHzib.jpg
670439,Six Minutes to Midnight,2020-10-15,Drama,Summer 1939. Influential families in Nazi Germany have sent their daughters to a finishing school in an English seaside town to learn the language and be ambassadors for a future looking National Socialist. A teacher there sees what is coming and is trying to raise the alarm. But the authorities believe he is the problem.,/uTo4Xisq2ikWNp11ULKaSk08954.jpg,/hOdW30Yk3aAmiWGjbfeNJ316QQY.jpg
646,Dr. No,1962-10-07,"Adventure, Action, Thriller","In the film that launched the James Bond saga, Agent 007 battles mysterious Dr. No, a scientific genius bent on destroying the U.S. space program. As the countdown to disaster begins, Bond must go to Jamaica, where he encounters beautiful Honey Ryder, to confront a megalomaniacal villain in his massive island headquarters.",/srgq7bzZsuDw7NoGXdazRXp7Hl6.jpg,/w9ph5cUfGbw41WXt7yuXsWeN2TV.jpg
6114,Bram Stoker's Dracula,1992-11-13,"Romance, Horror","When Dracula leaves the captive Jonathan Harker and Transylvania for London in search of Mina Harker, the reincarnation of Dracula's long-dead wife Elisabeta, obsessed vampire hunter Dr. Van Helsing sets out to end the madness.",/1ZVsHrPyogvUMJEuuB9eCkHSwaR.jpg,/n39glC4GkBeCbwdenES8ZBodim8.jpg
9730,Friday the 13th: The Final Chapter,1984-04-13,Horror,"After being mortally wounded and taken to the morgue, murderer Jason Voorhees spontaneously revives and embarks on a killing spree as he makes his way back to his home at Crystal Lake.",/aWmMWZ9rDNCXmXVXuHbEm1sX0jK.jpg,/5KRBkaF6PdorcFjWiDY4tJy67Jf.jpg
157845,The Rover,2014-06-04,"Crime, Drama","10 years after a global economic collapse, a hardened loner pursues the men who stole his car through the lawless wasteland of the Australian outback, aided by the brother of one of the thieves.",/62j9x1E2snlTfNtGmKU5JUgHFBH.jpg,/734OOkr69mt8lyPk8iw3TwgQ90R.jpg
587496,The Rental,2020-07-23,Horror,"Two couples on an oceanside getaway grow suspicious that the host of their seemingly perfect rental house may be spying on them. Before long, what should have been a celebratory weekend trip turns into something far more sinister.",/2gBMBfmQvHeOQQ5PiKiuxVdGs77.jpg,/3ynPnBXQVT2Y0s19fDIPlWKUlxH.jpg
785663,Old Henry,2021-10-01,"Western, Thriller","A widowed farmer and his son warily take in a mysterious, injured man with a satchel of cash. When a posse of men claiming to be the law come for the money, the farmer must decide who to trust. Defending a siege of his homestead, the farmer reveals a talent for gun-slinging that surprises everyone calling his true identity into question.",/n1oqHRtnJmv31VlWXTIwmDY6kz6.jpg,/oZ9DtoH8qqOmKQwz6HzdTS49EWc.jpg
79871,Crazy Love,1993-04-17,"Comedy, Romance","What was supposed to be summer school in England becomes an adventurous exotic and romantic journey for a beautiful teenage girl. [from the Tai Seng Catalog] A nice story of a free-sprited (or, depending on your viewpoint, prick-teasing) young woman on a short journey of discovery.",/4o3UH9Z6IYbxFIFYWCqAn4gwtfc.jpg,/vM4Tb2Wxk2X0Sgfy1wAS9bzSZsa.jpg
299687,The 5th Wave,2016-01-14,"Science Fiction, Adventure, Action",16-year-old Cassie Sullivan tries to survive in a world devastated by the waves of an alien invasion that has already decimated the population and knocked mankind back to the Stone Age.,/hqrwXs3KqPuU5rWoconbmQUn6rh.jpg,/4Dd79cz5qxKNoKWg1xsfrpOchEr.jpg
346685,The Girl on the Train,2016-10-05,"Crime, Drama, Mystery, Thriller","Rachel Watson, devastated by her recent divorce, spends her daily commute fantasizing about the seemingly perfect couple who live in a house that her train passes every day, until one morning she sees something shocking happen there and becomes entangled in the mystery that unfolds.",/4SO6pbGJTpM9YYovYxFLY3MXqZn.jpg,/AhTO2QWG0tug7yDoh0XoaMhPt3J.jpg
15070,Undisputed,2002-07-17,"Action, Adventure, Drama, Thriller","Monroe Hutchens is the heavyweight champion of Sweetwater, a maximum security prison. He was convicted to a life sentence due to a passionate crime. Iceman Chambers is the heavyweight champion, who lost his title due to a rape conviction to ten years in Sweetwater. WHen these two giants collide in the same prison, they fight against each other disputing who is the real champion.",/hxBroLYYRiuDlTPp7JlcwfzXXZe.jpg,/xgnCABtbMDaDqn9bt3ZFJTnpA3e.jpg
277216,Straight Outta Compton,2015-08-11,"Drama, Music","In 1987, five young men, using brutally honest rhymes and hardcore beats, put their frustration and anger about life in the most dangerous place in America into the most powerful weapon they had: their music.  Taking us back to where it all began, Straight Outta Compton tells the true story of how these cultural rebels—armed only with their lyrics, swagger, bravado and raw talent—stood up to the authorities that meant to keep them down and formed the world’s most dangerous group, N.W.A.  And as they spoke the truth that no one had before and exposed life in the hood, their voice ignited a social revolution that is still reverberating today.",/lM40xQYLDjrihfyYMPeOxM2V3Ci.jpg,/9B63hMwU6iICtNDTISCaZQ5US7R.jpg
20829,Funny People,2009-07-30,"Comedy, Drama","Famous and wealthy funnyman George Simmons doesn't give much thought to how he treats people until a doctor delivers stunning health news, forcing George to reevaluate his priorities with a little help from aspiring stand-up comic Ira.",/sifsRHexCPAIFHlsJVN5LbmVVWk.jpg,/gEYKD5cWCBGg8Za3hhwDBk3gEsP.jpg
9078,The Sword in the Stone,1963-12-25,"Animation, Family","Wart is a young boy who aspires to be a knight's squire. On a hunting trip he falls in on Merlin, a powerful but amnesiac wizard who has plans for him beyond mere squiredom. He starts by trying to give him an education, believing that once one has an education, one can go anywhere. Needless to say, it doesn't quite work out that way.",/7jvHnJcCSfk8bhjy9U78HZ9jzkC.jpg,/7lyeeuhGAJSNXYEW34S8mJ1bwI8.jpg
13078,The Babysitters,2008-05-09,Drama,"Seventeen-year-old Shirley is a good student who works as a babysitter in order to make money for college. One night Michael, a father Shirley works for, confesses he's unhappy with married life. Shirley has a crush on Michael, and seizes this moment to kiss him. Michael is so happy he presents Shirley with a big tip, which gives her an idea. Shirley plans to make extra money by setting up her teenage friends with other unhappy fathers.",/dGHqrzH8t0jmPSMxC5avfKe9Ewd.jpg,/nsrNUqGXI95unRKZEu8BJ584xWn.jpg
9323,Ghost in the Shell,1995-11-18,"Action, Animation, Science Fiction","In the year 2029, the barriers of our world have been broken down by the net and by cybernetics, but this brings new vulnerability to humans in the form of brain-hacking. When a highly-wanted hacker known as 'The Puppetmaster' begins involving them in politics, Section 9, a group of cybernetically enhanced cops, are called in to investigate and stop the Puppetmaster.",/g0pF9jXhPqm6TN3AAMWn0YeYayi.jpg,/9gC88zYUBARRSThcG93MvW14sqx.jpg
778730,Crazy About Her,2021-02-26,"Comedy, Romance","After a magical night together, Adri voluntarily turns himself into the psychiatric institution where Carla lives.",/y7b78soqvJq4aQ8G0Zt72inSQoE.jpg,/hPBJckYsL1UOsz44InZ2wYJyJTy.jpg
10607,Don't Be a Menace to South Central While Drinking Your Juice in the Hood,1996-01-12,Comedy,"When Ashtray (Shawn Wayans) moves to South Central L.A. to live with his father (who appears to be the same age he is) and grandmother (who likes to talk tough and smoke reefer), he falls in with his gang-banging cousin Loc Dog (Marlon Wayans), who along with the requisite pistols and Uzi carries a thermo-nuclear warhead for self-defense. Will Ashtray be able to keep living the straight life?",/we37KH1URxk8jrMaSKVHOmuqaDc.jpg,/HZQBF7JDd2e9p4rPSbSHuWHaCC.jpg
267935,The BFG,2016-06-01,"Adventure, Family, Fantasy","The BFG is no ordinary bone-crunching giant. He is far too nice and jumbly. It's lucky for Sophie that he is. Had she been carried off in the middle of the night by the Bloodbottler, or any of the other giants—rather than the BFG—she would have soon become breakfast. When Sophie hears that the giants are flush-bunking off to England to swollomp a few nice little chiddlers, she decides she must stop them once and for all. And the BFG is going to help her!",/tOTtJelsPKX0bvSdvDVL2ou3cGS.jpg,/4zawxGJIH43DcoGG9Ui0WoIcrQC.jpg
666243,The Witcher: Nightmare of the Wolf,2021-08-23,"Animation, Action, Fantasy","Escaping from poverty to become a witcher, Vesemir slays monsters for coin and glory, but when a new menace rises, he must face the demons of his past.",/orGlr1vHTgbDkGJPwuBjd8ncVjQ.jpg,/3sLz2yv6vBDWqBbd8rdnNeoJ2kJ.jpg
447743,Inuyashiki,2018-04-20,"Action, Adventure, Science Fiction, Fantasy",A middle-aged office worker encounters aliens and is gifted with alien technology and limitless powers.,/xPdnOm3ATLWgxvRJXXUywp519zs.jpg,/lyqkQ6y7d4YGVQrRjtmGTRMVcDY.jpg
82390,The Paperboy,2012-09-14,"Thriller, Drama, Mystery","As investigative reporter Ward Jansen and his partner Yardley Acheman chase a sensational, career-making story with the help of Ward's younger brother Jack and sultry death-row groupie Charlotte Bless, the pair tries to prove violent swamp-dweller Hillary Van Wetter was framed for the murder of a corrupt local sheriff.",/qrRugDSIN9i9u0ClGP7X193Akjf.jpg,/AiALtw5Nl4adb6oO4VndBPo3RkQ.jpg
874562,Swallow,2021-10-01,"Drama, History, Thriller, Crime","Set in the 1980s, Tolani Ajao is a bank secretary in Lagos, who finds herself persuaded by her friend Rose Adamson to enter the world of drug trafficking.",/njzhDHltKLT4DSYphnOBWCoyQMs.jpg,/dS6ZFMGJx7I1JZ6lFoRLP2pQYh0.jpg
203316,Evil Woman,2013-02-13,"Crime, Drama","Rosario is a paid assassin who kills men who mistreat or abuse women. When the police capture her, it's the end of the myth. But Maria, a hysteric invalid, saves Rosario in exchange for a different job.",,/7jqDObs4w3fJx8m33HEq6YTdOZh.jpg
134162,Doraemon: Nobita and the Kingdom of Clouds,1992-03-07,Animation,"Doraemon launches its ecological adventure to save Earth from a terrible threat with Nobita and his whole gang. This time Doraemon used his inventions to create, along with Nobita, his own world in the sky, a giant cloud. During their journey to the cloud are alien beings who seek to destroy civilization to chasten humans for their lack of commitment to the environment. Doraemon and the gang must find allies and convince the people of the clouds on Earth that there are people who fight for nature. In his adventure, meet good friends, raffled countless dangers, will encounter prehistoric animals and will give everything to defend our planet.",/sRfhl2ff0OdJT6QC68Bo9bAb5SY.jpg,/ch12oEXzm5uXroWSQmp2fOwGYbV.jpg
127372,Emperor,2012-09-14,"Drama, History, War","As the Japanese surrender at the end of WWII, Gen. Fellers is tasked with deciding if Emperor Hirohito will be hanged as a war criminal. Influencing his ruling is his quest to find Aya, an exchange student he met years earlier in the U.S.",/l4e79vedsCaaHgES8sGCPafDyQw.jpg,/lKcRXcffQM2KxNruljrd7H3gUe5.jpg
372519,The Ten Commandments: The Movie,2016-01-28,Drama,Follows Moses leading and conducting the Hebrew people from the slavery of Egypt to the freedom towards the Promised Land according to the Ancient Testament Bible book of the Exodus. The story told like never before is faithful to the Scriptures.,/v6bGT2CgGGs2oClMHMXUs1mgFY6.jpg,/yctfYDrHAPcJP54D2BCH9R5GTY2.jpg
17899,"Sex, Party and Lies",2009-03-27,"Comedy, Drama","A youth group is preparing for what will be the summer of their life, including secrets, lies, sex, confusion, evenings and holidays.",/pv82OBJIF3v5inCkpxfb2XZFYta.jpg,/uOJEJFrb2DX4odPfvaTwS7edpbq.jpg
354282,The Osiris Child,2016-02-17,Science Fiction,"Set in the future in a time of interplanetary colonization, an unlikely pair race against an impending global crisis and are confronted by the monsters that live inside us all.",/5HlTix2YQw24NCGZ7D83VJeRkLh.jpg,/3sx69bH2n2tgvknvq2VROJ6lEXS.jpg
71880,Jack and Jill,2011-11-11,Comedy,"Jack Sadelstein, a successful advertising executive in Los Angeles with a beautiful wife and kids, dreads one event each year: the Thanksgiving visit of his twin sister Jill. Jill's neediness and passive-aggressiveness is maddening to Jack, turning his normally tranquil life upside down.",/moMs64IweGkJt1pwEAlsAFu3OFt.jpg,/kFeAxmZvu0TE4iuLRHQD6Cej8Wf.jpg
660943,Memories of My Father,2020-08-22,Drama,"Portrays the life of Héctor Abad Gómez, a prominent doctor and human rights activist in the polarized, violent Medellin of the 70s. A family man worried not only for his own children but those of the underprivileged classes as well, his home was imbued with vitality and creativity, the result of an education based on tolerance and love. Nothing could foretell that a terrible cancer would take the life of one of his beloved daughters. Driven by sadness and rage, Héctor devoted himself to the social and political causes of the time. But Medellin's intolerant society would harass him until he was finally silenced.",/2l8Mcy6MD8MoqYmQIuGcKz63Sra.jpg,/AnFd9DkA3UGhqmEVtPN9rIIJoH7.jpg
330459,Rogue One: A Star Wars Story,2016-12-14,"Action, Adventure, Science Fiction",A rogue band of resistance fighters unite for a mission to steal the Death Star plans and bring a new hope to the galaxy.,/6t8ES1d12OzWyCGxBeDYLHoaDrT.jpg,/5jX3p0apUG5bkMHtnKZch0xpkBS.jpg
601980,Grisaia: Phantom Trigger The Animation,2019-03-15,"Action, Animation","Following the Heath Oslo incident, the existence of the US-Japanese anti-terror organization CIRS has become a matter of public knowledge. CIRS has been rebuilt from the ground up, and its most covert functions spun off to a new agency: SORD (Social Ops, Research & Development).  The goal of SORD is to train a new generation of operatives to defend the country against future threats. To that end, the organization has established a series of schools up and down the country. Mihama Academy, more-or-less left to rot after its abrupt closure, has been given new purpose as one such 'specialist training school'. It now entrusts the misfit girls who attend it with guns and live ammunition.  No matter how much life grinds them down, what future awaits these girls, who've themselves chosen the path of the gun?",/qvUiNH0VwtIfGNXCBgmWsh22aWb.jpg,/zYrFLXGRiqFsNQuK1hNEMOmSMPA.jpg
14613,Next Avengers: Heroes of Tomorrow,2008-09-02,"Animation, Family",The children of the Avengers hone their powers and go head to head with the very enemy responsible for their parents' demise.,/gCzHEi6g8K0LIWlr6A38fmgtEfb.jpg,/4NL4vwuh6AlwgGoNNlhVp52DRfi.jpg
567609,Ready or Not,2019-08-21,"Horror, Thriller, Comedy",A bride's wedding night takes a sinister turn when her eccentric new in-laws force her to take part in a terrifying game.,/qkwx1zZEkSfotNw10tlENar9ef9.jpg,/vOl6shtL0wknjaIs6JdKCpcHvg8.jpg
736604,The Boy from Medellín,2020-09-11,"Documentary, Music",Colombian reggaeton singer J Balvin prepares for his 2019 homecoming concert amid intense political turmoil.,/xOukYlFEuiY9FZXd5kjWiigjBJA.jpg,/ffJX00pcQDGvzhz6RSngeYuSb6U.jpg
11284,Freddy's Dead: The Final Nightmare,1991-09-05,"Horror, Thriller, Comedy","Just when you thought it was safe to sleep, Freddy Krueger returns in this sixth installment of the Nightmare on Elm Street films, as psychologist Maggie Burroughs, tormented by recurring nightmares, meets a patient with the same horrific dreams. Their quest for answers leads to a certain house on Elm Street -- where the nightmares become reality.",/tyUTNUtKUHvBpd0xnrwb0BVgjQs.jpg,/doyiGwpxbBs4G2og9G8gV7ZKoih.jpg
76589,Justice League: Doom,2012-02-28,"Action, Animation","An adaptation of Mark Waid's ""Tower of Babel"" story from the JLA comic. Vandal Savage steals confidential files Batman has compiled on the members of the Justice League, and learns all their weaknesses.",/50gUUeIQZXHI1vXtuyiFAYa499u.jpg,/seCbcjdZYUl8SRKjeWfyi2ngzFj.jpg
381719,Peter Rabbit,2018-02-07,"Animation, Adventure, Family",Peter Rabbit's feud with Mr. McGregor escalates to greater heights than ever before as they rival for the affections of the warm-hearted animal lover who lives next door.,/o9SXE8dWTqfaHLzbdygdH6M3uOR.jpg,/2yjSvEDuM3rLDng40erLsWkQRfn.jpg
650783,The Comeback Trail,2020-11-12,"Action, Comedy, Crime","Two movie producers who owe money to the mob, have to set up their aging movie star to kill themselves accidentally so they don't have to owe them back but they wind up getting more than they ever imagined.",/wRrhiUWQSrmCzuVRTUfrei6p3VY.jpg,/ublJIJbc2NZ30ptXj4O2d2apo1t.jpg
28874,Summer Wars,2009-08-01,Animation,"Kenji is your typical teenage misfit. He’s good at math, bad with girls, and spends most of his time hanging out in the all-powerful online community known as OZ. His second life is the only life he has — until the girl of his dreams, Natsuki, hijacks him for a starring role as a fake fiancé at her family reunion. Things only get stranger from there. A late-night email containing a cryptic mathematic riddle leads to the unleashing of a rogue AI intent on using the virtual world of OZ to destroy the real world. As Armageddon looms on the horizon, Kenji and his new “family” set aside their differences and band together to save the worlds they inhabit in this “near-perfect blend of social satire and science fiction.”",/laWosEOIzqSmMzJrDc9S8NTzRvd.jpg,/yHy8TrRLnuBZ4t2C0l0pSpRXVHO.jpg
420634,Terrifier,2016-10-15,"Horror, Thriller",A maniacal clown named Art terrorizes three young women and everyone else who stands in his way on Halloween night.,/fBNnj5bQ5YhzPUzxIW1UvLVZepP.jpg,/6PQqC4SbY910VvyVad6mvsboILU.jpg
4108,The Transporter,2002-10-02,"Action, Crime, Thriller","Former Special Forces officer, Frank Martin will deliver anything to anyone for the right price, and his no-questions-asked policy puts him in high demand. But when he realizes his latest cargo is alive, it sets in motion a dangerous chain of events. The bound and gagged Lai is being smuggled to France by a shady American businessman, and Frank works to save her as his own illegal activities are uncovered by a French detective.",/stHcCE5mQIzDDgFVxZZ0UfD0hIh.jpg,/v3QIFUWgtVN4wejVuDZowuyJ20W.jpg
474395,Teen Titans Go! To the Movies,2018-07-27,"Animation, Action, Comedy, Science Fiction","All the major DC superheroes are starring in their own films, all but the Teen Titans, so Robin is determined to remedy this situation by getting over his role as a sidekick and becoming a movie star. Thus, with a few madcap ideas and an inspirational song in their hearts, the Teen Titans head to Hollywood to fulfill their dreams.",/6FTc6G8gwawItBqGQd7sYtf6s3f.jpg,/mFHihhE9hlvJEk2f1AqdLRaYHd6.jpg
516632,The Empty Man,2020-10-22,"Horror, Mystery, Thriller","Retired cop James Lasombra is asked by a friend to investigate the disappearance of her daughter, who seemingly packed in the night and left an ominous message on the bathroom mirror - ""The Empty Man Made Me Do It."" As he investigates this mysterious figure further, James begins to see and hear strange things, and is forced to come to terms with his past and what it means for his future.",/9nm3eQY0FiPL391vlQrr4Q5WC9w.jpg,/8apzu9JFTUMtOpYkHk6LNPOs3pY.jpg
268,Batman,1989-06-23,"Fantasy, Action","Batman must face his most ruthless nemesis when a deformed madman calling himself ""The Joker"" seizes control of Gotham's criminal underworld.",/2va32apQP97gvUxaMnL5wYt4CRB.jpg,/r7XF6duZy5ZXmOX7HE3fKGV1WLN.jpg
613911,Bliss,2021-02-05,"Science Fiction, Romance, Drama","A mind-bending love story following Greg who, after recently being divorced and then fired, meets the mysterious Isabel, a woman living on the streets and convinced that the polluted, broken world around them is just a computer simulation. Doubtful at first, Greg eventually discovers there may be some truth to Isabel’s wild conspiracy.",/eSl9MRMvWJ0Hm5yePHgsRhFtPTw.jpg,/tbTiSr0v9g8Q34MIeIcT0o2vGus.jpg
530385,Midsommar,2019-07-03,"Horror, Drama, Mystery","Several friends travel to Sweden to study as anthropologists a summer festival that is held every ninety years in the remote hometown of one of them. What begins as a dream vacation in a place where the sun never sets, gradually turns into a dark nightmare as the mysterious inhabitants invite them to participate in their disturbing festive activities.",/g6GtOfXtzDpY73ef7wludoorTti.jpg,/7LEI8ulZzO5gy9Ww2NVCrKmHeDZ.jpg
23172,The Spy Next Door,2010-01-15,"Action, Comedy, Family","Former CIA spy Bob Ho takes on his toughest assignment to date: looking after his girlfriend's three kids, who haven't exactly warmed to their mom's beau. And when one of the youngsters accidentally downloads a top-secret formula, Bob's longtime nemesis, a Russian terrorist, pays a visit to the family.",/wgLiHsGHVqGfBPmJeATwWXTEA3W.jpg,/nJJrceb2xHGIA0irADX0JvWSIHT.jpg
602,Independence Day,1996-06-25,"Action, Adventure, Science Fiction","On July 2, a giant alien mothership enters orbit around Earth and deploys several dozen saucer-shaped 'destroyer' spacecraft that quickly lay waste to major cities around the planet. On July 3, the United States conducts a coordinated counterattack that fails. On July 4, a plan is devised to gain access to the interior of the alien mothership in space, in order to plant a nuclear missile.",/uw4SnKFZ453Gxmj5XR5Susj8TNo.jpg,/p0BPQGSPoSa8Ml0DAf2mB2kCU0R.jpg
9316,Ong Bak: Muay Thai Warrior,2003-01-21,"Action, Thriller","When the head of a statue sacred to a village is stolen, a young martial artist goes to the big city and finds himself taking on the underworld to retrieve it.",/xnwGxfKuFD4Dx8GcT7YtjmM0Odk.jpg,/oagqAwp48dMPoCT94yDJUDOCVPi.jpg
763568,Arlo the Alligator Boy,2021-04-16,"Animation, Comedy, Family","Upon learning that he is from New York City, a wide-eyed boy, who is half human and half alligator, decides to leave his sheltered life in the swamp and search for his long lost father. A musical adventure.",/hNCGEGCg65c1qI0kWs1eVsvP0Y0.jpg,/oOQMJM7G2W8v2AEK722k8welIJY.jpg
533642,Child's Play,2019-06-19,Horror,"Karen, a single mother, gifts her son Andy a Buddi doll for his birthday, unaware of its more sinister nature. A contemporary re-imagining of the 1988 horror classic.",/vHse4QK31Vc3X7BKKU5GOQhYxv6.jpg,/rpS7ROczWulqfaXG2klYapULXKm.jpg
458253,Missing Link,2019-04-04,"Family, Animation, Comedy, Adventure, Fantasy","The charismatic Sir Lionel Frost considers himself to be the world's foremost investigator of myths and monsters. Trouble is, none of his small-minded, high-society peers seems to recognize this. Hoping to finally gain acceptance from these fellow adventurers, Sir Lionel travels to the Pacific Northwest to prove the existence of a legendary creature known as the missing link.",/ob4XnKBqAh1rg381hayebJx6EkE.jpg,/gEkKHiiQRVUSX15Iwo8VFydXrtu.jpg
342473,Ballerina,2016-12-14,"Animation, Adventure, Comedy, Family","Set in 1879 Paris. An orphan girl dreams of becoming a ballerina and flees her rural Brittany for Paris, where she passes for someone else and accedes to the position of pupil at the Grand Opera house.",/wlLdcK3Sm7zp0w1ZuVvnFlmcchM.jpg,/qBxMhcmNnFniuDAZTKEHcSgKtsn.jpg
