id,name,date,genre,description,backdrop,poster
50253,Saint Seiya Heaven Chapter: Overture,2004-02-14,"Animation, Fantasy","After the bloody battle against Hades, the goddess Athena and her saints are still recovering when they find themselves face to face with their newest and most formidable foe: the dreadful moon goddess Artemis. Artemis replaces Athena as the earth guardian deity and takes over the Sanctuary, turning Athena's Saints into her servants.  Upon invading the Sanctuary, the Bronze Saints learn that Athena was banished by Artemis and decide to fight the moon goddess in order to rescue their true goddess and free the Earth from Artemis's ominous control.",/afMyocyc9QHdksy5EAJW6Mm2rt4.jpg,/gUEqAmR99OmyEPXb7wJpKtEIwLy.jpg
8355,Ice Age: Dawn of the Dinosaurs,2009-06-26,"Animation, Comedy, Family, Adventure","Times are changing for Manny the moody mammoth, Sid the motor mouthed sloth and Diego the crafty saber-toothed tiger. Life heats up for our heroes when they meet some new and none-too-friendly neighbors – the mighty dinosaurs.",/gkxSIlZPEwGPimQ8TEE8C52cOSO.jpg,/cXOLaxcNjNAYmEx1trZxOTKhK3Q.jpg
504253,I Want to Eat Your Pancreas,2018-09-01,"Animation, Drama, Romance, Family","Spring time in April and the last of the cherry blossoms are still in bloom. The usually aloof bookworm with no interest in others comes across a book in a hospital waiting room. Handwritten on the cover are the words: ""Living with Dying."" He soon discovers that it is a diary kept by his very popular and genuinely cheerful classmate, Sakura Yamauchi, who reveals to him that she is secretly suffering from a pancreatic illness and only has a limited time left. It is at this moment that she gains just one more person to share her secret. Trying to maintain a normal life as much as possible, Sakura is determined to live her life to the fullest until the very last day. As her free spirit and unpredictable actions throw him for a loop, his heart begins to gradually change.",/YLyORLsYIjC0d1TFBSpJKk7piP.jpg,/vHdVU0HyyB6k6kuYt8qjwTz9one.jpg
284054,Black Panther,2018-02-13,"Action, Adventure, Science Fiction","King T'Challa returns home to the reclusive, technologically advanced African nation of Wakanda to serve as his country's new leader. However, T'Challa soon finds that he is challenged for the throne by factions within his own country as well as without. Using powers reserved to Wakandan kings, T'Challa assumes the Black Panther mantle to join with ex-girlfriend Nakia, the queen-mother, his princess-kid sister, members of the Dora Milaje (the Wakandan 'special forces') and an American secret agent, to prevent Wakanda from being dragged into a world war.",/b6ZJZHUdMEFECvGiDpJjlfUWela.jpg,/uxzzxijgPIY7slzFvMotPv8wjKA.jpg
12,Finding Nemo,2003-05-30,"Animation, Family","Nemo, an adventurous young clownfish, is unexpectedly taken from his Great Barrier Reef home to a dentist's office aquarium. It's up to his worrisome father Marlin and a friendly but forgetful fish Dory to bring Nemo home -- meeting vegetarian sharks, surfer dude turtles, hypnotic jellyfish, hungry seagulls, and more along the way.",/dFYguAfeVt19qAbzJ5mArn7DEJw.jpg,/eHuGQ10FUzK1mdOY69wF5pGgEf5.jpg
75948,The Sorcerer and the White Snake,2011-09-27,"Action, Fantasy",The Sorcerer and the White Snake is an ancient Chinese fable about a woman demon who falls in love with a mortal is brought to life through the latest advances in CGI and action techniques.,/oIXnmpQXADWUF8JXSjKNlSw78qk.jpg,/5Jfv3CtMULd41C5jpLR8PGAMgE3.jpg
9820,The Parent Trap,1998-07-28,"Comedy, Family","Hallie Parker and Annie James are identical twins separated at a young age because of their parents' divorce. Unknowingly to their parents, the girls are sent to the same summer camp where they meet, discover the truth about themselves, and then plot with each other to switch places.",/mrYJ0ijgaxjHKAs0ybNYxyfP8l5.jpg,/a3XOGrrAjl1wwiumtACWBufg6AL.jpg
433945,Tokyo Ghoul,2017-07-16,"Action, Drama, Horror, Thriller","A Tokyo college student is attacked by a ghoul, a super-powered human who feeds on human flesh. He survives, but has become part ghoul and becomes a fugitive on the run.",/1bjoIR8Yb3qDrflszNWlz9uo2JF.jpg,/tMs8ZJ2dNJ0fExF7ISXJvOov4Y6.jpg
45243,The Hangover Part II,2011-05-25,Comedy,"The Hangover crew heads to Thailand for Stu's wedding. After the disaster of a bachelor party in Las Vegas last year, Stu is playing it safe with a mellow pre-wedding brunch. However, nothing goes as planned and Bangkok is the perfect setting for another adventure with the rowdy group.",/yOI0pECyaTFViMlzdYYpi3nqjLc.jpg,/7sGkjqorTHkaHTz8Q4WWHj8JL9t.jpg
820232,Demon Slayer: Kimetsu no Yaiba Sibling's Bond,2019-03-29,"Action, Animation, Fantasy","Tanjiro finds his family slaughtered and the lone survivor, his sister Nezuko Kamado, turned into a Demon. To his surprise, however, Nezuko still shows signs of human emotion and thought. Thus begins Tanjiro's journey to seek out the Demon who killed their family and turn his sister human again. A recap film of Kimetsu no Yaiba, covering episodes 1-5 with extra footage.",/8NEvnVKeGMLEXG45MMNqxJLcM4y.jpg,/vIwQ2PAnrLQtYJBtqnXHpjikMXa.jpg
10193,Toy Story 3,2010-06-16,"Animation, Family, Comedy","Woody, Buzz, and the rest of Andy's toys haven't been played with in years. With Andy about to go to college, the gang find themselves accidentally left at a nefarious day care center. The toys must band together to escape and return home to Andy.",/csDxOOSjfcJNNRo4ma8ltVynELV.jpg,/4cpGytCB0eqvRks4FAlJoUJiFPG.jpg
594328,Phineas and Ferb: The Movie: Candace Against the Universe,2020-08-28,"Family, Animation, Science Fiction, Comedy, TV Movie","Phineas and Ferb travel across the galaxy to rescue their older sister Candace, who has been abducted by aliens and taken to a utopia in a far-off planet, free of her pesky little brothers.",/lkeBhXGJFRlhI7cBWn8LQQAdZqK.jpg,/n6hptKS7Y0ZjkYwbqKOK3jz9XAC.jpg
72105,Ted,2012-06-29,"Comedy, Fantasy","John Bennett, a man whose childhood wish of bringing his teddy bear to life came true, now must decide between keeping the relationship with the bear or his girlfriend, Lori.",/nEcEy7iVOh04dzZWP2e6AcwpLvI.jpg,/2ZetTSYM8ATcrxh4Otge99GJRTz.jpg
339403,Baby Driver,2017-06-28,"Action, Crime","After being coerced into working for a crime boss, a young getaway driver finds himself taking part in a heist doomed to fail.",/yir5430WblZSZuIMd9C6pIZerfA.jpg,/rmnQ9jKW72bHu8uKlMjPIb2VLMI.jpg
691179,Friends: The Reunion,2021-05-27,Documentary,"The cast of Friends reunites for a once-in-a-lifetime celebration of the hit series, an unforgettable evening filled with iconic memories, uncontrollable laughter, happy tears, and special guests.",/y1BomwRA41Cr8s69G9vVQRjwllp.jpg,/bT3c4TSOP8vBmMoXZRDPTII6eDa.jpg
287947,Shazam!,2019-03-29,"Action, Comedy, Fantasy",A boy is given the ability to become an adult superhero in times of need with a single magic word.,/qwgGtdlLMKYvT2tV8hLY22syRHN.jpg,/xnopI5Xtky18MPhK40cZAGAOVeV.jpg
265712,Stand by Me Doraemon,2014-08-08,"Animation, Family, Science Fiction, Fantasy","In the suburbs of Tokyo some time ago, there lived a clumsy boy about 10 years old. There appeared in front of him named Sewashi, Nobita's descendant of four generations later from the 22nd century, and Doraemon, a 22nd century cat-type caretaker robot who helps people with its secret gadgets. Sewashi claims that his family is suffering from the debts Nobita made even to his generation, so in order to change this disastrous future, he brought along Doraemon as Nobita's caretaker to bring happiness to his future, although Doraemon is not happy about this. And so Sewashi installed an accomplishment program into Doraemon forcing him to take care of Nobita. Unless he makes Nobita happy, Doraemon can no longer go back to the 22nd century. This is how the life of Doraemon and Nobita begins. Will Doraemon succeed this mission and return to the 22nd century?",/1aABIiqBY7yoQESE8qWvR0w9bJZ.jpg,/jArnRnllnxbvE2CEV8jc2hhwweS.jpg
7182,Venom,2005-09-16,"Horror, Thriller","A group of teenagers fear for their lives in the swamps of Louisiana, chased by Mr. Jangles, a man possessed by 13 evil souls, and now relentless in his pursuit of new victims.",/wXCelVZcQE0bSsBC0r6LNsJIRnI.jpg,/hCMTpv1I9KK90ApxXDyaf8SwJcf.jpg
150540,Inside Out,2015-06-09,"Animation, Family, Adventure, Drama, Comedy","Growing up can be a bumpy road, and it's no exception for Riley, who is uprooted from her Midwest life when her father starts a new job in San Francisco. Riley's guiding emotions— Joy, Fear, Anger, Disgust and Sadness—live in Headquarters, the control centre inside Riley's mind, where they help advise her through everyday life and tries to keep things positive, but the emotions conflict on how best to navigate a new city, house and school.",/o3i6AfTcWAuNvzAUV3q5lOmi6Gx.jpg,/2H1TmgdfNtsKlU9jKdeNyYL5y8T.jpg
341174,Fifty Shades Darker,2017-02-08,"Drama, Romance","When a wounded Christian Grey tries to entice a cautious Ana Steele back into his life, she demands a new arrangement before she will give him another chance. As the two begin to build trust and find stability, shadowy figures from Christian’s past start to circle the couple, determined to destroy their hopes for a future together.",/16aJtXO6lObbBUr11IvkjB1QD1f.jpg,/y8SDjMI2uejj2e2NaAmiI9dnPki.jpg
825597,Maggie Simpson in The Force Awakens from Its Nap,2021-05-04,"Family, Animation, Comedy, Science Fiction","In a daycare far, far away… but still in Springfield, Maggie is on an epic quest for her stolen pacifier. Her adventure brings her face-to-face with young Padawans, Sith Lords, familiar droids, Rebel scum, and an ultimate battle against the dark side, in this original short celebrating the Star Wars galaxy.",/ldZ37wdvIxIGOadZAJZhWNp4AdF.jpg,/2xnf2ZaGXudvgBKPtVXMkNeooh1.jpg
57158,The Hobbit: The Desolation of Smaug,2013-12-11,"Fantasy, Adventure, Action","The Dwarves, Bilbo and Gandalf have successfully escaped the Misty Mountains, and Bilbo has gained the One Ring. They all continue their journey to get their gold back from the Dragon, Smaug.",/bSQjIZO9aJCJBqxGX3Sx2xtujzT.jpg,/xQYiXsheRCDBA39DOrmaw1aSpbk.jpg
299537,Captain Marvel,2019-03-06,"Action, Adventure, Science Fiction","The story follows Carol Danvers as she becomes one of the universe’s most powerful heroes when Earth is caught in the middle of a galactic war between two alien races. Set in the 1990s, Captain Marvel is an all-new adventure from a previously unseen period in the history of the Marvel Cinematic Universe.",/w2PMyoyLU22YvrGK3smVM9fW1jj.jpg,/AtsgWhDnHTq68L0lLsUrCnM7TjG.jpg
845422,Bankrolled,2021-07-23,Comedy,"While blind drunk, two unemployed millennials entrepreneurs drunkenly post a video pitch about their revolutionary app to a crowdfunding site. When the app catches fire and they accidentally raise millions of dollars they actually have to create the app.",/80sOjpOe7M7sYjvYlhdnQTdxCl7.jpg,/ytenWBdOd9UtMjyAsJuqBbTl67X.jpg
560050,Over the Moon,2020-10-16,"Animation, Adventure, Family, Fantasy","In this animated musical, a girl builds a rocket ship and blasts off, hoping to meet a mythical moon goddess.",/htBUhLSS7FfHtydgYxUWjL3J1Q1.jpg,/lQfdytwN7eh0tXWjIiMceFdBBvD.jpg
875828,Untitled Peaky Blinders Film,TBA,,An untitled film connected to the hit BBC TV Show - 'Peaky Blinders'. It will release after Season 6 and will finish the story of the Shelby family.,/jRKirDMJxkgrV6QvuvaNvIb2nEb.jpg,/39tRjFng3DYLU4dd7zzGue0kORa.jpg
77338,The Intouchables,2011-11-02,"Drama, Comedy",A true story of two men who should never have met – a quadriplegic aristocrat who was injured in a paragliding accident and a young man from the projects.,/bGksau9GGu0uJ8DJQ8DYc9JW5LM.jpg,/ttx4GQl0azO6NJFWj4XNZCQOY7S.jpg
158015,The Purge,2013-05-31,"Science Fiction, Horror, Thriller","Given the country's overcrowded prisons, the U.S. government begins to allow 12-hour periods of time in which all illegal activity is legal. During one of these free-for-alls, a family must protect themselves from a home invasion.",/siBfSB55FBc7IdvgtApq6NaXNHw.jpg,/1x4fHaDdlpWT5P2UV4ClKguWbTE.jpg
621870,Secret Society of Second Born Royals,2020-09-25,"Action, Adventure, Comedy, Fantasy","Sam is a teenage royal rebel, second in line to the throne of the kingdom of Illyria. Just as her disinterest in the royal way of life is at an all-time high, she discovers she has super-human abilities and is invited to join a secret society of similar extraordinary second-born royals charged with keeping the world safe.",/oSSEcPDfwgZSv2i01Oqxdb9t8fI.jpg,/xOmGTJtBgRVSAF4S5dZEUqHqyy5.jpg
718867,The Larva Island Movie,2020-07-23,"Animation, Family","Back at home, Chuck relates the island shenanigans of his larva pals Red and Yellow to a skeptical reporter in this movie sequel to the hit cartoon.",/53aUwtolUZxgzMr2KbDpOnD8jo3.jpg,/uHdxICUIRGoJjK67aOp3ykvL8ZW.jpg
420818,The Lion King,2019-07-12,"Adventure, Family, Animation","Simba idolizes his father, King Mufasa, and takes to heart his own royal destiny. But not everyone in the kingdom celebrates the new cub's arrival. Scar, Mufasa's brother—and former heir to the throne—has plans of his own. The battle for Pride Rock is ravaged with betrayal, tragedy and drama, ultimately resulting in Simba's exile. With help from a curious pair of newfound friends, Simba will have to figure out how to grow up and take back what is rightfully his.",/1TUg5pO1VZ4B0Q1amk3OlXvlpXV.jpg,/dzBtMocZuJbjLOXvrl4zGYigDzh.jpg
20662,Robin Hood,2010-05-12,Adventure,"When soldier Robin happens upon the dying Robert of Loxley, he promises to return the man's sword to his family in Nottingham. There, he assumes Robert's identity; romances his widow, Marion; and draws the ire of the town's sheriff and King John's henchman, Godfrey.",/h7AKqgIh86HDgJIzENeR2ng1Knn.jpg,/9NS5QGOfck24yL3bZqWeW06PgPC.jpg
136418,Hummingbird,2013-05-07,"Action, Thriller","Homeless and on the run from a military court martial, a damaged ex-special forces soldier navigating London's criminal underworld seizes an opportunity to assume another man's identity, transforming into an avenging angel in the process.",/4jSG8EjEJOwpIABIotN4bPTZMX7.jpg,/bN2aGUOxHRwGms68WTDr2MHzkKa.jpg
35,The Simpsons Movie,2007-07-25,"Animation, Comedy, Family","After Homer accidentally pollutes the town's water supply, Springfield is encased in a gigantic dome by the EPA and the Simpsons are declared fugitives.",/o7XHctO2t4fIdzch8v8ApNaJMcX.jpg,/gzb6P78zeFTnv9eoFYnaJ2YrZ5q.jpg
647302,Benny Loves You,2019-11-21,"Horror, Comedy","Jack, a man desperate to improve his life, throws away his beloved childhood plush, Benny. It’s a move that has disastrous consequences when Benny springs to life with deadly intentions!",/czHYg6LQ5926OL8wj5kC09pNR12.jpg,/o32SQgwZQFBa9eK1ADc5Oo1sP4y.jpg
87101,Terminator Genisys,2015-06-23,"Science Fiction, Action, Thriller, Adventure","The year is 2029. John Connor, leader of the resistance continues the war against the machines. At the Los Angeles offensive, John's fears of the unknown future begin to emerge when TECOM spies reveal a new plot by SkyNet that will attack him from both fronts; past and future, and will ultimately change warfare forever.",/g4a5YLWwi6OCp8TcvxsUNrXMbN5.jpg,/oZRVDpNtmHk8M1VYy1aeOWUXgbC.jpg
48340,Sanctum,2011-02-03,"Action, Thriller","Master diver Frank McGuire (Richard Roxburgh) has explored the South Pacific's Esa-ala Caves for months.  But when his exit is cut off in a flash flood, Frank's team—including 17-year-old son Josh (Rhys Wakefield) and financier Carl Hurley (Ioan Gruffudd)—are forced to radically alter plans.  With dwindling supplies, the crew must navigate an underwater labyrinth to make it out.  Soon, they are confronted with the unavoidable question: Can they survive, or will they be trapped forever?",/Bj1V9TObjgbKc4qZRvnNESgKmc.jpg,/zRUNv1CbeVtmTCNr6RLHnxV2QYm.jpg
866408,Mutation on Mars,2021-08-27,"Drama, Science Fiction","In the near future, the Earth’s resources are gradually getting scarce. In order to continue the hope of survival for generations of children and grandchildren, top scientists from various countries have brought several species of animals and plants to Mars for research, hoping to improve the Martian environment through advanced science and technology to make it suitable for human habitation.",/xZiMSXA8w1T2nWlXPDjN0RAYOvQ.jpg,/h4HcBZC8XMuSFBNxWu7qd34tFDI.jpg
197158,Porno,1981-01-01,Drama,"Three tales of the erotic: Two young ladies experiment with lesbianism, a handsome and wealthy socialite makes a beautiful woman patiently wait to make love to him, and a gorgeous, but controlling and dominating blind woman makes a hunky stud her sexual hostage in her swanky mansion home.",,/bhbPSpYjsRJAK7rXqL8APK9EwBl.jpg
51620,Death Race 2,2010-11-12,"Action, Thriller, Science Fiction","In the world's most dangerous prison, a new game is born: Death Race. The rules of this adrenaline-fueled blood sport are simple, drive or die. When repentant convict Carl Lucas discovers there's a price on his head, his only hope is to survive a twisted race against an army of hardened criminals and tricked-out cars.",/5viGnT4PiwF1BTh5ZwOW5VON7Ss.jpg,/80mBFNVvak2bA9TJN1MD0yM7Lfi.jpg
10764,Quantum of Solace,2008-10-31,"Adventure, Action, Thriller, Crime","Quantum of Solace continues the adventures of James Bond after Casino Royale. Betrayed by Vesper, the woman he loved, 007 fights the urge to make his latest mission personal. Pursuing his determination to uncover the truth, Bond and M interrogate Mr. White, who reveals that the organization that blackmailed Vesper is far more complex and dangerous than anyone had imagined.",/3CqMIX3ZlrD0pU3fpBL6DM0Cneb.jpg,/e3DXXLJHGqMx9yYpXsql1XNljmM.jpg
60304,Hansel & Gretel: Witch Hunters,2013-01-17,"Fantasy, Horror, Action","After getting a taste for blood as children, Hansel and Gretel have become the ultimate vigilantes, hell-bent on retribution. Now, unbeknownst to them, Hansel and Gretel have become the hunted, and must face an evil far greater than witches... their past.",/5HEOaYkPnXiGY6fPE4VedqaAZF9.jpg,/j343Rpj3WeNvP0SV80zveve70io.jpg
121,The Lord of the Rings: The Two Towers,2002-12-18,"Adventure, Fantasy, Action","Frodo and Sam are trekking to Mordor to destroy the One Ring of Power while Gimli, Legolas and Aragorn search for the orc-captured Merry and Pippin. All along, nefarious wizard Saruman awaits the Fellowship members at the Orthanc Tower in Isengard.",/nS4picOwj15APKzJeBCk6EBcMG5.jpg,/5VTN0pR8gcqV3EPUHHfMGnJYN9L.jpg
240832,Lucy,2014-07-25,"Action, Science Fiction","A woman, accidentally caught in a dark deal, turns the tables on her captors and transforms into a merciless warrior evolved beyond human logic.",/1hzH1Wu2xhXBNOWzw3RMwNTJX5q.jpg,/kRbpUTRNm6QbLQFPFWUcNC4czEm.jpg
159824,Hotel Transylvania 2,2015-09-21,"Family, Animation, Comedy, Fantasy","When the old-old-old-fashioned vampire Vlad arrives at the hotel for an impromptu family get-together, Hotel Transylvania is in for a collision of supernatural old-school and modern day cool.",/mfnkxXWuh2Br097Qteq8ieqKfev.jpg,/kKFgwQnR5q08UFsAvtoYyTIiHyj.jpg
436931,Pokémon the Movie: I Choose You!,2017-07-15,"Family, Animation, Adventure, Fantasy","Ash Ketchum wakes up late one morning after having broken his alarm clock in his sleep. He eventually makes it to Professor Oak's lab, but is told that the three starter List of Pokémon (Bulbasaur, Squirtle, and Charmander) have already been taken by Trainers who were on time. However, Oak reveals that he has one more Pokémon, an Electric-type named Pikachu. Despite its volatile and feisty personality, as well as its refusal to get inside a Poké Ball, Ash happily takes Pikachu for his journey.",/jLS805N4QmLVPurQwuaCFTNEZss.jpg,/cmpOaiRtjnhLNF2iPslMXCOcVJ.jpg
597,Titanic,1997-11-18,"Drama, Romance","101-year-old Rose DeWitt Bukater tells the story of her life aboard the Titanic, 84 years later. A young Rose boards the ship with her mother and fiancé. Meanwhile, Jack Dawson and Fabrizio De Rossi win third-class tickets aboard the ship. Rose tells the whole story from Titanic's departure through to its death—on its first and last voyage—on April 15, 1912.",/6VmFqApQRyZZzmiGOQq2C92jyvH.jpg,/9xjZS2rlVxm8SFx8kPC3aIGCOYQ.jpg
283995,Guardians of the Galaxy Vol. 2,2017-04-19,"Adventure, Action, Science Fiction, Comedy",The Guardians must fight to keep their newfound family together as they unravel the mysteries of Peter Quill's true parentage.,/aJn9XeesqsrSLKcHfHP4u5985hn.jpg,/y4MBh0EjBlMuOzv9axM4qJlmhzz.jpg
168259,Furious 7,2015-04-01,"Action, Thriller, Crime, Adventure",Deckard Shaw seeks revenge against Dominic Toretto and his family for his comatose brother.,/gyCHdpyPXmp7rqxE10nlImkzRo9.jpg,/wurKlC3VKUgcfsn0K51MJYEleS2.jpg
720026,Butchers,2021-01-12,Horror,"A family of sadistic butchers lives deep inside the backcountry. From the dead of winter to the dog days of summer, anyone who crosses their path is dead meat.",/jxYROBerNLUExmqFb2yArglwIHd.jpg,/xLbuMxKORru3oTlItLBWpI5WJxR.jpg
797394,Secret Magic Control Agency,2021-03-18,"Animation, Comedy, Fantasy","The Secret Magic Control Agency sends its two best agents, Hansel and Gretel, to fight against the witch of the Gingerbread House.",/tzJZaglq1hR7RS35BKG68Xz7KY0.jpg,/4ZSzEDVdxWVMVO4oZDvoodQOEfr.jpg
249070,Hitman: Agent 47,2015-08-20,"Action, Crime, Thriller",An assassin teams up with a woman to help her find her father and uncover the mysteries of her ancestry.,/yRtZmZa2bmDYaOKygG7IaroSXwg.jpg,/iuUxXng5JNmRPxxFEd3MWFmNsSG.jpg
39513,Paul,2011-02-14,"Adventure, Comedy, Science Fiction","For the past 60 years, a space-traveling smart-ass named Paul has been locked up in a top-secret military base, advising world leaders about his kind. But when he worries he’s outlived his usefulness and the dissection table is drawing uncomfortably close, Paul escapes on the first RV that passes by his compound in Area 51. Fortunately, it contains the two earthlings who are most likely to rescue and harbor an alien on the run.",/h1V5rmTgnPVXd4vFUyVR2vwIpor.jpg,/bX8TP2qRWh2OcmeUHGn1ENDkCu6.jpg
641960,Four Good Days,2021-04-30,Drama,A mother helps her daughter work through four crucial days of recovery from substance abuse.,/serQTpLKTSNdGhmNMZarfa6wnah.jpg,/uaJmqZxwAsdFLLjPGH5DzIEnbpj.jpg
307081,Southpaw,2015-03-24,"Action, Drama","Billy ""The Great"" Hope, the reigning junior middleweight boxing champion, has an impressive career, a loving wife and daughter, and a lavish lifestyle. However, when tragedy strikes, Billy hits rock bottom, losing his family, his house and his manager. He soon finds an unlikely savior in Tick Willis, a former fighter who trains the city's toughest amateur boxers. With his future on the line, Hope fights to reclaim the trust of those he loves the most.",/1tXlUvfhLVjM5rZcN2783IhCkbu.jpg,/r6QlMEQGNvM0YpbN04qhx5xdMiQ.jpg
345938,The Shack,2017-03-03,"Drama, Fantasy","After suffering a family tragedy, Mack Phillips spirals into a deep depression causing him to question his innermost beliefs. Facing a crisis of faith, he receives a mysterious letter urging him to an abandoned shack deep in the Oregon wilderness. Despite his doubts, Mack journeys to the shack and encounters an enigmatic trio of strangers led by a woman named Papa. Through this meeting, Mack finds important truths that will transform his understanding of his tragedy and change his life forever.",/bAup7FGUlmNVOuhZFlLgmDPo0Eg.jpg,/doAzav9kfdtsoSdw1MDFvjKq3J4.jpg
52520,Underworld: Awakening,2012-01-19,"Fantasy, Action, Horror","Having escaped years of imprisonment, vampire warrioress Selene finds herself in a changed world where humans have discovered the existence of both Vampire and Lycan clans and are conducting an all-out war to eradicate both immortal species. Now Selene must battle the humans and a frightening new breed of super Lycans to ensure the death dealers' survival.",/v63E5H5TD7Eay1gZPVt9ibP9riy.jpg,/jN0uuc8U6M3sTg9zEaliJV60Stf.jpg
420809,Maleficent: Mistress of Evil,2019-10-16,"Family, Fantasy, Adventure","Maleficent and her goddaughter Aurora begin to question the complex family ties that bind them as they are pulled in different directions by impending nuptials, unexpected allies, and dark new forces at play.",/skvI4rYFrKXS73BJxWGH54Omlvv.jpg,/vloNTScJ3w7jwNwtNGoG8DbTThv.jpg
484718,Coming 2 America,2021-03-05,Comedy,"Prince Akeem Joffer is set to become King of Zamunda when he discovers he has a son he never knew about in America – a street savvy Queens native named Lavelle. Honoring his royal father's dying wish to groom this son as the crown prince, Akeem and Semmi set off to America once again.",/vKzbIoHhk1z9DWYi8kyFe9Gg0HF.jpg,/nWBPLkqNApY5pgrJFMiI9joSI30.jpg
3170,Bambi,1942-08-14,"Animation, Drama, Family","Bambi's tale unfolds from season to season as the young prince of the forest learns about life, love, and friends.",/cNHXm0Bv5GpatBOliHt9UdsyVFW.jpg,/wV9e2y4myJ4KMFsyFfWYcUOawyK.jpg
136797,Need for Speed,2014-03-12,"Action, Crime, Drama, Thriller","The film revolves around a local street-racer who partners with a rich and arrogant business associate, only to find himself framed by his colleague and sent to prison. After he gets out, he joins a New York-to-Los Angeles race to get revenge. But when the ex-partner learns of the scheme, he puts a massive bounty on the racer's head, forcing him to run a cross-country gauntlet of illegal racers in all manner of supercharged vehicles.",/syVAWAnY6fTBDDFntHsM8vFjKex.jpg,/z42kyMizgDKetejusZgucSQsQ4l.jpg
