id,name,date,genre,description,backdrop,poster
550988,Free Guy,2021-08-11,"Comedy, Action, Adventure, Science Fiction",A bank teller called Guy realizes he is a background character in an open world video game called Free City that will soon go offline.,/8Y43POKjjKDGI9MH89NW0NAzzp8.jpg,/xmbU4JTUm8rsdtn7Y3Fcm30GpeT.jpg
568620,Snake Eyes: G.I. Joe Origins,2021-07-22,"Action, Adventure","After saving the life of their heir apparent, tenacious loner Snake Eyes is welcomed into an ancient Japanese clan called the Arashikage where he is taught the ways of the ninja warrior. But, when secrets from his past are revealed, Snake Eyes' honor and allegiance will be tested – even if that means losing the trust of those closest to him.",/aO9Nnv9GdwiPdkNO79TISlQ5bbG.jpg,/uIXF0sQGXOxQhbaEaKOi2VYlIL0.jpg
637534,The Stronghold,2021-08-18,"Crime, Thriller","A police brigade working in the dangerous northern neighborhoods of Marseille, where the level of crime is higher than anywhere else in France.",/vkIJ2QgcKMJRvi6pBW4Tr2kgLdy.jpg,/nLanxl7Xhfbd5s8FxPy8jWZw4rv.jpg
703771,Deathstroke: Knights & Dragons - The Movie,2020-08-04,"Animation, Action, Adventure, Science Fiction",The assassin Deathstroke tries to save his family from the wrath of H.I.V.E. and the murderous Jackal.,/owraiceOKtSOa3t8sp3wA9K2Ox6.jpg,/vFIHbiy55smzi50RmF8LQjmpGcx.jpg
681887,Cosmic Sin,2021-03-12,Science Fiction,"In the year 2524, four centuries after humans started colonizing the outer planets, retired General James Ford gets called back into service when a hostile alien fleet attacks soldiers on a remote planet. The threat against mankind soon escalates into an interstellar war as Ford and a team of elite soldiers try to stop the imminent attack before it's too late.",/umAoDwLZMBrYeCDfbJYFRMuXWAr.jpg,/6Wm7P6y22UZA40QuPYHyWyJ6leI.jpg
589754,The Last Warrior: Root of Evil,2021-01-01,"Fantasy, Adventure, Comedy","Peace and tranquility have set in Belogorie. The evil was defeated and Ivan is now enjoying his well-deserved fame. He is surrounded by his family, friends and small wonders from the modern world that help him lead a comfortable life. Luckily, he has his Magic Sword to cut a gap between the worlds to get some supplies quite regularly. But when an ancient evil rises and the existence of the magic world is put to danger, Ivan has to team up with his old friends and his new rivals. They will set out on a long journey beyond the known world to find a way to defeat the enemies and to return peace to Belogorie.",/dIibeeq4QMay5bTJ2vjr72IFFRo.jpg,/5VJSIAhSn4qUsg5nOj4MhQhF5wQ.jpg
580489,Venom: Let There Be Carnage,2021-09-30,"Science Fiction, Action","After finding a host body in investigative reporter Eddie Brock, the alien symbiote must face a new enemy, Carnage, the alter ego of serial killer Cletus Kasady.",/t9nyF3r0WAlJ7Kr6xcRYI4jr9jm.jpg,/rjkmN1dniUHVYAtwuV3Tji7FsDO.jpg
839436,Dragon Fury,2021-06-15,"Horror, Fantasy, Mystery",A group of soldiers are taken to the mountains of Wales to investigate a strange beast.,/5PQhNs4M3RxIqaNAdBI6mXlXyYh.jpg,/6WcJ4cV2Y3gnTYp5zHu968TYmTJ.jpg
566525,Shang-Chi and the Legend of the Ten Rings,2021-09-01,"Action, Adventure, Fantasy",Shang-Chi must confront the past he thought he left behind when he is drawn into the web of the mysterious Ten Rings organization.,/cinER0ESG0eJ49kXlExM0MEWGxW.jpg,/xeItgLK9qcafxbd8kYgv7XnMEog.jpg
631843,Old,2021-07-21,"Mystery, Thriller, Horror",A group of families on a tropical holiday discover that the secluded beach where they are staying is somehow causing them to age rapidly – reducing their entire lives into a single day.,/iTgM25ftE7YtFgZwUZupVp8A61S.jpg,/vclShucpUmPhdAOmKgf3B3Z4POD.jpg
597316,My Little Pony: A New Generation,2021-09-23,"Animation, Family, Fantasy, Comedy, Music, Adventure","Equestria's divided. But a bright-eyed hero believes Earth Ponies, Pegasi and Unicorns should be pals — and, hoof to heart, she’s determined to prove it.",/ugukqzx4gSzBd1yzmbWEHLkpGaS.jpg,/hzq5XRGgm6NDMOW1idUvbpGqEkv.jpg
859860,Catch the Bullet,2021-09-10,"Western, Action","U.S. marshal Britt MacMasters returns from a mission to find his father wounded and his son kidnapped by the outlaw Jed Blake. Hot on their trail, Britt forms a posse with a gunslinging deputy and a stoic Pawnee tracker. But Jed and Britt tread dangerously close to the Red Desert’s Sioux territory.",/MDYanFolbT76dj0gsCbhS2GM5A.jpg,/qKxrBZ8Ts4KHZKp7BT6GAVMLFO2.jpg
436969,The Suicide Squad,2021-07-28,"Action, Adventure, Fantasy, Comedy","Supervillains Harley Quinn, Bloodsport, Peacemaker and a collection of nutty cons at Belle Reve prison join the super-secret, super-shady Task Force X as they are dropped off at the remote, enemy-infused island of Corto Maltese.",/jlGmlFOcfo8n5tURmhC7YVd4Iyy.jpg,/kb4s0ML0iVZlG6wAKbbs9NAm6X.jpg
588921,Ainbo: Spirit of the Amazon,2021-02-09,"Adventure, Animation, Family, Fantasy",null,/3GgkzCDq6KYpcmJmcOKh27hYRyj.jpg,/l8HyObVj8fPrzacAPtGWWLDhcfh.jpg
725273,Solitary,2021-09-24,Science Fiction,"A man wakes up inside a room to discover he's a prisoner sent into space to form Earth's first colony, and worse - his cell mate Alana is hell bent on destroying everything.",/iDLtDgxLiYsarfdQ4msUhUqoNPp.jpg,/ApwmbrMlsuOay5rXQA4Kbz7qJAl.jpg
597891,Kate,2021-09-10,"Action, Thriller","After she's irreversibly poisoned, a ruthless criminal operative has less than 24 hours to exact revenge on her enemies and in the process forms an unexpected bond with the daughter of one of her past victims.",/byflnwPMumyvrCW9SfO5Miq3647.jpg,/uJgdT1boTSP0dDIjdTgGleg71l4.jpg
451048,Jungle Cruise,2021-07-28,"Adventure, Fantasy, Comedy, Action","Dr. Lily Houghton enlists the aid of wisecracking skipper Frank Wolff to take her down the Amazon in his dilapidated boat. Together, they search for an ancient tree that holds the power to heal – a discovery that will change the future of medicine.",/7WJjFviFBffEJvkAms4uWwbcVUk.jpg,/9dKCd55IuTT5QRs989m9Qlb7d2B.jpg
335983,Venom,2018-09-28,"Science Fiction, Action","Investigative journalist Eddie Brock attempts a comeback following a scandal, but accidentally becomes the host of Venom, a violent, super powerful alien symbiote. Soon, he must rely on his newfound powers to protect the world from a shadowy organization looking for a symbiote of their own.",/VuukZLgaCrho2Ar8Scl9HtV3yD.jpg,/2uNW4WbgBXL25BAbXGLnLqX71Sw.jpg
508943,Luca,2021-06-17,"Animation, Comedy, Family, Fantasy",Luca and his best friend Alberto experience an unforgettable summer on the Italian Riviera. But all the fun is threatened by a deeply-held secret: they are sea monsters from another world just below the water’s surface.,/620hnMVLu6RSZW6a5rwO8gqpt0t.jpg,/jTswp6KyDYKtvC52GbHagrZbGvD.jpg
385128,F9,2021-05-19,"Action, Crime, Thriller",Dominic Toretto and his crew battle the most skilled assassin and high-performance driver they've ever encountered: his forsaken brother.,/xXHZeb1yhJvnSHPzZDqee0zfMb6.jpg,/bOFaAXmWWXC3Rbv4u4uM9ZSzRXP.jpg
595743,SAS: Red Notice,2021-08-11,"Drama, Action, Thriller","An off-duty SAS soldier, Tom Buckingham, must thwart a terror attack on a train running through the Channel Tunnel. As the action escalates on the train, events transpire in the corridors of power that may make the difference as to whether Buckingham and the civilian passengers make it out of the tunnel alive.",/zHHcindG4uVZLPLuYWoo4rnv6Ti.jpg,/6Y9fl8tD1xtyUrOHV2MkCYTpzgi.jpg
482373,Don't Breathe 2,2021-08-12,"Thriller, Horror","The Blind Man has been hiding out for several years in an isolated cabin and has taken in and raised a young girl orphaned from a devastating house fire. Their quiet life together is shattered when a group of criminals kidnap the girl, forcing the Blind Man to leave his safe haven to save her.",/pUc51UUQb1lMLVVkDCaZVsCo37U.jpg,/hRMfgGFRAZIlvwVWy8DYJdLTpvN.jpg
825997,Rogue Hostage,2021-06-11,"Action, Thriller",A former Marine races against time to save a group of hostages -- including his young daughter and a congressman — when armed militants take over his stepfather's store.,/uZDE9VnKFnIPmWriMjnp82bH9S8.jpg,/ePYagdzUwKpzTP73n9CD3D1MFn.jpg
675445,PAW Patrol: The Movie,2021-08-09,"Animation, Family, Adventure, Comedy",Ryder and the pups are called to Adventure City to stop Mayor Humdinger from turning the bustling metropolis into a state of chaos.,/mtRW6eAwOO27h3zrfU2foQFW7Hg.jpg,/ic0intvXZSfBlYPIvWXpU1ivUCO.jpg
497698,Black Widow,2021-07-07,"Action, Adventure, Thriller, Science Fiction","Natasha Romanoff, also known as Black Widow, confronts the darker parts of her ledger when a dangerous conspiracy with ties to her past arises. Pursued by a force that will stop at nothing to bring her down, Natasha must deal with her history as a spy and the broken relationships left in her wake long before she became an Avenger.",/keIxh0wPr2Ymj0Btjh4gW7JJ89e.jpg,/qAZ0pzat24kLdO3o8ejmbLxyOac.jpg
459151,The Boss Baby: Family Business,2021-07-01,"Animation, Comedy, Adventure, Family",The Templeton brothers — Tim and his Boss Baby little bro Ted — have become adults and drifted away from each other. But a new boss baby with a cutting-edge approach and a can-do attitude is about to bring them together again … and inspire a new family business.,/akwg1s7hV5ljeSYFfkw7hTHjVqk.jpg,/uWStkK8bq9ixY3fc7y209ZleCoF.jpg
744275,After We Fell,2021-09-01,"Romance, Drama","Just as Tessa's life begins to become unglued, nothing is what she thought it would be. Not her friends nor her family. The only person that she should be able to rely on is Hardin, who is furious when he discovers the massive secret that she's been keeping. Before Tessa makes the biggest decision of her life, everything changes because of revelations about her family.",/qD45xHA35HdJDGOaA1AgDwiWEgO.jpg,/3WfvjNWr5k1Zzww81b3GWc8KQhb.jpg
379686,Space Jam: A New Legacy,2021-07-08,"Animation, Comedy, Family, Science Fiction","When LeBron and his young son Dom are trapped in a digital space by a rogue A.I., LeBron must get them home safe by leading Bugs, Lola Bunny and the whole gang of notoriously undisciplined Looney Tunes to victory over the A.I.'s digitized champions on the court. It's Tunes versus Goons in the highest-stakes challenge of his life.",/8s4h9friP6Ci3adRGahHARVd76E.jpg,/5bFK5d3mVTAvBCXi5NPWH0tYjKl.jpg
635302,Demon Slayer -Kimetsu no Yaiba- The Movie: Mugen Train,2020-10-16,"Animation, Action, Adventure, Fantasy","Tanjirō Kamado, joined with Inosuke Hashibira, a boy raised by boars who wears a boar's head, and Zenitsu Agatsuma, a scared boy who reveals his true power when he sleeps, boards the Infinity Train on a new mission with the Fire Hashira, Kyōjurō Rengoku, to defeat a demon who has been tormenting the people and killing the demon slayers who oppose it!",/xPpXYnCWfjkt3zzE0dpCNME1pXF.jpg,/h8Rb9gBr48ODIwYUttZNYeMWeUU.jpg
785752,Intrusion,2021-09-22,Thriller,"When a husband and wife move to a small town, a home invasion leaves the wife traumatized and suspicious that those around her might not be who they seem.",/oM7AstNYo6eSkgAieXvsIxTPPDv.jpg,/o6ozTBflWXlBje0uxJv4m6s4HTq.jpg
522241,The Courier,2021-03-18,"Thriller, Drama, History",Cold War spy Greville Wynne and his Russian source try to put an end to the Cuban Missile Crisis.,/3pIqd1hgZ2xqzWEyiYp4blqE9Fi.jpg,/zFIjKtZrzhmc7HecdFXXjsLR2Ig.jpg
619778,Malignant,2021-09-01,"Horror, Thriller, Mystery, Crime","Madison is paralyzed by shocking visions of grisly murders, and her torment worsens as she discovers that these waking dreams are in fact terrifying realities with a mysterious tie to her past.",/xDnFlNrNUoSKPq4uptnhYmUZNpm.jpg,/dGv2BWjzwAz6LB8a8JeRIZL8hSz.jpg
585216,Escape Room: Tournament of Champions,2021-07-01,"Horror, Thriller, Mystery","Six people unwittingly find themselves locked in another series of escape rooms, slowly uncovering what they have in common to survive as they discover all the games that they've played before.",/dsdbViTNjLu4DbgkkYmuY4xDQ20.jpg,/jGYJyPzVgrVV2bgClI9uvEZgVLE.jpg
370172,No Time to Die,2021-09-29,"Adventure, Action, Thriller","Bond has left active service and is enjoying a tranquil life in Jamaica. His peace is short-lived when his old friend Felix Leiter from the CIA turns up asking for help. The mission to rescue a kidnapped scientist turns out to be far more treacherous than expected, leading Bond onto the trail of a mysterious villain armed with dangerous new technology.",/kcvKEvTWqIGMjpVJdbDVRHdIt4C.jpg,/iUgygt3fscRoKWCV1d0C7FbM9TP.jpg
848278,Jurassic Hunt,2021-08-26,"Action, Science Fiction, Thriller","Female adventurer Parker joins a crew of male trophy hunters in a remote wilderness park. Their goal: slaughter genetically recreated dinosaurs for sport using rifles, arrows, and grenades. After their guide is killed by raptors, the team tries to escape the park – but the hunters quickly become the hunted. Even worse, the park’s manager suspects Parker of being a spy and sends a hit squad after her. This battle’s about to become primitive!",/gzppdxEJ6fofhtLzSVSUJZEVxvq.jpg,/bZnOioDq1ldaxKfUoj3DenHU7mp.jpg
619297,Sweet Girl,2021-08-18,Action,"A devastated husband vows to bring justice to the people responsible for his wife's death while protecting the only family he has left, his daughter.",/nprqOIEfiMMQx16lgKeLf3rmPrR.jpg,/cP7odDzzFBD9ycxj2laTeFWGLjD.jpg
843906,Straight Outta Nowhere: Scooby-Doo! Meets Courage the Cowardly Dog,2021-09-14,"Animation, Comedy, Mystery, Family, Fantasy","With Mystery, Inc. on the tail of a strange object in Nowhere, Kansas, the strange hometown of Eustice, Muriel, and Courage, the gang soon find themselves contending with a giant cicada monster and her winged warriors.",/26LIw3oKGPUEGUpb8AXZ64dZZt8.jpg,/uIdMpWrQ30SHPINsy7LcPFloyvO.jpg
739990,Nightbooks,2021-09-15,"Fantasy, Family, Horror","Alex, a boy obsessed with scary stories, is trapped by a witch in her modern, magical New York City apartment. His original hair-raising tales are the only thing keeping him safe as he desperately tries to find a way out of this twisted place.",/piz0BFUJ4Bro4BFzxxkNpsGCmOd.jpg,/ysJte1iqN8pFQ470tumnViB1wHP.jpg
706972,Narco Sub,2021-01-22,"Action, Drama, Crime","A man will become a criminal to save his family.  Director: Shawn Welling  Writer: Derek H. Potts  Stars: Tom Vera, Tom Sizemore, Lee Majors |",/AjQgFtfXTmmMVuaH2VfQDdGbeQH.jpg,/7p0O4mKYLIhU2E5Zcq9Z3vOZ4e9.jpg
641501,How I Became a Superhero,2020-11-19,"Science Fiction, Adventure, Mystery, Action, Thriller, Fantasy, Comedy","Paris 2020. While superheroes have assimilated into the Parisian society, they discover a new drug that gives themselves personal superpowers to mere mortals. Lieutenants Moreau and Schaltzmann are investigating the case with the support of two ex-superheroes, Monte Carlo and Callista. They'll do whatever it takes to dismantle the traffic. But Moreau's past resurfaces, and the investigation becomes more complicated.",/kDQdFs5XL6G8TuXvd0NnJfQ59GP.jpg,/d0wn9YtEnmbucx8ZUsT918ctoiK.jpg
850818,"Barbie: Big City, Big Dreams",2021-08-20,"Animation, Music, Family","Barbie swaps the sunny shores of Malibu for the bright lights of Broadway to attend an excusive summer performing arts program and meets…Barbie!  Fast friends, the two discover they share more than a name as they explore New York City and all the amazing things they have in common.  As they compete for the coveted once-in-a-lifetime Spotlight Solo from Times Square, the friends discover competition isn’t all about winning, it’s about striving to be your best, overcoming doubts, and sharing the spotlight.",/rnSn1m7na0AkvVelLVR7y9B85jV.jpg,/8PCeAhmRkiWYLBq0quetaFrHZp3.jpg
337404,Cruella,2021-05-26,"Comedy, Crime","In 1970s London amidst the punk rock revolution, a young grifter named Estella is determined to make a name for herself with her designs. She befriends a pair of young thieves who appreciate her appetite for mischief, and together they are able to build a life for themselves on the London streets. One day, Estella’s flair for fashion catches the eye of the Baroness von Hellman, a fashion legend who is devastatingly chic and terrifyingly haute. But their relationship sets in motion a course of events and revelations that will cause Estella to embrace her wicked side and become the raucous, fashionable and revenge-bent Cruella.",/kmuSGNlF9mfNHIDOEVEWPj6f3Ak.jpg,/wToO8opxkGwKgSfJ1JK8tGvkG6U.jpg
637649,Wrath of Man,2021-04-22,"Action, Crime, Thriller","A cold and mysterious new security guard for a Los Angeles cash truck company surprises his co-workers when he unleashes precision skills during a heist. The crew is left wondering who he is and where he came from. Soon, the marksman's ultimate motive becomes clear as he takes dramatic and irrevocable steps to settle a score.",/70AV2Xx5FQYj20labp0EGdbjI6E.jpg,/M7SUK85sKjaStg4TKhlAVyGlz3.jpg
460465,Mortal Kombat,2021-04-07,"Action, Fantasy, Adventure","Washed-up MMA fighter Cole Young, unaware of his heritage, and hunted by Emperor Shang Tsung's best warrior, Sub-Zero, seeks out and trains with Earth's greatest champions as he prepares to stand against the enemies of Outworld in a high stakes battle for the universe.",/9yBVqNruk6Ykrwc32qrK2TIE5xw.jpg,/nkayOAUBUu4mMvyNf9iHSUiPjF1.jpg
565028,Candyman,2021-08-25,"Horror, Thriller","Anthony and his partner move into a loft in the now gentrified Cabrini-Green, and after a chance encounter with an old-timer exposes Anthony to the true story behind Candyman, he unknowingly opens a door to a complex past that unravels his own sanity and unleashes a terrifying wave of violence.",/mHU833IrBRfZ3hhzEQsiiw2D8Nc.jpg,/dqoshZPLNsXlC1qtz5n34raUyrE.jpg
525660,Dynasty Warriors,2021-04-29,"Action, Adventure, Fantasy","Warlords, warriors and statesmen wage a battle for supremacy in this fantasy tale based on the hit video games and the ""Romance of the Three Kingdoms.""",/iJ2HVOZT9Kjayrhy21pbGIJs9ey.jpg,/7BCTdek5LFHglcgl7shsm7igJAH.jpg
659940,The Marco Effect,2021-05-27,"Thriller, Crime","When 14-year-old Marco, a homeless Romani boy, is arrested at the Danish border for possession of a missing public servant's passport, police inspector Carl Mørck and his Department Q team are tasked with finding the connection. The old case contains several suspicious elements: The public servant was accused of pedophilia shortly before he disappeared, and his case was closed unusually quickly. But the silent, traumatized Marco refuses to talk to them and it's not long before he's on the run from those who intend to kill him because of what he knows.",/b8cduNIEf75tBSFXDwBJfNAQMFP.jpg,/fZNugFFV3xCNVR2Br4xGgfJil0Q.jpg
588228,The Tomorrow War,2021-07-02,"Action, Science Fiction, Adventure","The world is stunned when a group of time travelers arrive from the year 2051 to deliver an urgent message: Thirty years in the future, mankind is losing a global war against a deadly alien species. The only hope for survival is for soldiers and civilians from the present to be transported to the future and join the fight. Among those recruited is high school teacher and family man Dan Forester. Determined to save the world for his young daughter, Dan teams up with a brilliant scientist and his estranged father in a desperate quest to rewrite the fate of the planet.",/yizL4cEKsVvl17Wc1mGEIrQtM2F.jpg,/34nDCQZwaEvsy4CFO5hkGRFDCVU.jpg
573164,Eggs Run,2021-08-12,"Animation, Comedy",A rooster and his fowl partner embark on a dangerous trip to the Congo to recover their stolen eggs from a group of Russian goons.,/uHmvk8FnoxpgujDU0RIXLkv2fNt.jpg,/wrlQnKHLCBheXMNWotyr5cVDqNM.jpg
581726,Infinite,2021-06-10,"Science Fiction, Action, Thriller","Evan McCauley has skills he never learned and memories of places he has never visited. Self-medicated and on the brink of a mental breakdown, a secret group that call themselves “Infinites” come to his rescue, revealing that his memories are real.",/tUwgWj9EUK70qqkIlkwzMejc9wJ.jpg,/niw2AKHz6XmwiRMLWaoyAOAti0G.jpg
685274,Mobile Suit Gundam Hathaway,2021-06-11,"Animation, Action, Drama, Science Fiction","After Char's rebellion, Hathaway Noa leads an insurgency against Earth Federation, but meeting an enemy officer and a mysterious woman alters his fate.",/mI0Qo7VtgW5siCtQQqNPXIk0Ar6.jpg,/6gw8onh4FKsruBA7Oouv01EFxzn.jpg
399566,Godzilla vs. Kong,2021-03-24,"Action, Adventure, Fantasy","In a time when monsters walk the Earth, humanity’s fight for its future sets Godzilla and Kong on a collision course that will see the two most powerful forces of nature on the planet collide in a spectacular battle for the ages.",/inJjDhCjfhh3RtrJWBmmDqeuSYC.jpg,/pgqgaUx1cJb5oZQQ5v0tNARCeBp.jpg
672322,Rurouni Kenshin: The Beginning,2021-06-04,"Action, Adventure, Drama","Before he was a protector, Kenshin was a fearsome assassin known as Battosai. But when he meets gentle Tomoe Yukishiro, a beautiful young woman who carries a huge burden in her heart, his life will change forever.",/heMC3jAjQPNSlr1n9mZKUQ58EOE.jpg,/rODS466qSdrwMlGdbUwPENhDN2c.jpg
861057,Swim,2021-08-13,"Horror, Action","A family gets trapped in their storm flooded vacation rental, tries to escape from a hungry shark that made it's way into the house.",/leDpP52W54kQvIxBd93G8lgTLCx.jpg,/pBSqH6avxduNAnXhyIkcAfcUMJ0.jpg
19995,Avatar,2009-12-10,"Action, Adventure, Fantasy, Science Fiction","In the 22nd century, a paraplegic Marine is dispatched to the moon Pandora on a unique mission, but becomes torn between following orders and protecting an alien civilization.",/AmHOQ7rpHwiaUMRjKXztnauSJb7.jpg,/jRXYjXNq0Cs2TcJjLkki24MLp7u.jpg
602223,The Forever Purge,2021-06-30,"Horror, Action, Thriller",All the rules are broken as a sect of lawless marauders decides that the annual Purge does not stop at daybreak and instead should never end as they chase a group of immigrants who they want to punish because of their harsh historical past.,/tehpKMsls621GT9WUQie2Ft6LmP.jpg,/lB068qa6bQ0QKYKyC2xnYGvYjl7.jpg
726684,Miraculous World: Shanghai – The Legend of Ladydragon,2021-04-04,"Animation, Comedy, Family, Adventure","On school break, Marinette heads to Shanghai to meet Adrien. But after arriving, Marinette loses all her stuff, including the Miraculous that allows her to turn into Ladybug!",/rlNnwObbMu5G2FaOUlacnUIdIIA.jpg,/qQ0VKsGRQ2ofAmswGNzZnvC1xPE.jpg
597433,Beckett,2021-08-04,"Action, Adventure, Crime, Drama, Thriller, Mystery","While vacationing in Greece, Beckett, becomes the target of a manhunt after a devastating car accident forces him to run for his life across the country to clear his name but tensions escalate as the authorities close in and political unrest mounts which makes Beckett fall even deeper into a dangerous web of conspiracy.",/lzLzKXq2C0kL5Pu7VW5sNl5KV6L.jpg,/fBJducGBcmrcIOQdhm4BUBNDiMu.jpg
608804,The Girl Who Killed Her Parents,2021-09-24,"Crime, Drama, Thriller","Based on one of the most shocking and gruesome murder cases in Brazil, the film presents Daniel Cravinhos's point of view of the events that led to the death of Marísia and Manfred von Richthofen, his girlfriend’s parents.",/6RSmdzLx5Y975kKREVfa1KdCYMS.jpg,/7gqZyGlLjNKXIk8RBswqAGJygVz.jpg
678580,El mesero,2021-07-15,Comedy,A waiter pretends to be an important businessman in order to reach the upper class through his entrepreneurial dreams.,/sjp19s49gm58iKbq64AxJxg9JgN.jpg,/zvGC5jX5wQmU1GgPc0VGZz7Mtcs.jpg
846214,"The Simpsons: The Good, the Bart, and the Loki",2021-07-07,"Animation, Comedy, Family",Loki is banished from Asgard once again and must face his toughest opponents yet: the Simpsons and Springfield’s mightiest heroes. The God of Mischief teams up with Bart Simpson in the ultimate crossover event paying tribute to the Marvel Cinematic Universe of superheroes and villains.,/zsH3iW60T1t2HBTtrSKzzxJ406J.jpg,/rtMdtzywcAGOrF6t8fbxJBqpdcq.jpg
841755,Mortal Kombat Legends: Battle of the Realms,2021-08-30,"Animation, Action, Fantasy","The Earthrealm heroes must journey to the Outworld and fight for the survival of their homeland, invaded by the forces of evil warlord Shao Kahn, in the tournament to end all tournaments: the final Mortal Kombat.",/dssCw0mUmD4EriUmkwB3PnsGu4q.jpg,/ablrE8IbWcIrAxMmm4gnPn75AMS.jpg
539885,Ava,2020-07-02,"Action, Crime, Drama, Thriller",A black ops assassin is forced to fight for her own survival after a job goes dangerously wrong.,/54yOImQgj8i85u9hxxnaIQBRUuo.jpg,/qzA87Wf4jo1h8JMk9GilyIYvwsA.jpg
632357,The Unholy,2021-03-31,Horror,"Alice, a young hearing-impaired girl who, after a supposed visitation from the Virgin Mary, is inexplicably able to hear, speak and heal the sick. As word spreads and people from near and far flock to witness her miracles, a disgraced journalist hoping to revive his career visits the small New England town to investigate. When terrifying events begin to happen all around, he starts to question if these phenomena are the works of the Virgin Mary or something much more sinister.",/jw6ASGRT2gi8EjCImpGtbiJ9NQ9.jpg,/bShgiEQoPnWdw4LBrYT5u18JF34.jpg
813258,Monster Pets: A Hotel Transylvania Short,2021-04-02,"Animation, Comedy, Fantasy",Drac tries out some new monster pets to help occupy Tinkles for playtime.,/c7dFSqZQYqNNJVpacpIGZe3gkLW.jpg,/tuzkEyCPwf5O56fDjGNerIA8hxT.jpg
527774,Raya and the Last Dragon,2021-03-03,"Family, Fantasy, Animation, Action, Adventure","Long ago, in the fantasy world of Kumandra, humans and dragons lived together in harmony. But when an evil force threatened the land, the dragons sacrificed themselves to save humanity. Now, 500 years later, that same evil has returned and it’s up to a lone warrior, Raya, to track down the legendary last dragon to restore the fractured land and its divided people.",/3emtmbHAp145frh3Pps1bZCCEHY.jpg,/lPsD10PP4rgUGiGR4CCXA6iY0QQ.jpg
