id,name,date,genre,description,backdrop,poster
2454,The Chronicles of Narnia: Prince Caspian,2008-05-15,"Adventure, Family, Fantasy","One year after their incredible adventures in the Lion, the Witch and the Wardrobe, Peter, Edmund, Lucy and Susan Pevensie return to Narnia to aid a young prince whose life has been threatened by the evil King Miraz. Now, with the help of a colorful cast of new characters, including Trufflehunter the badger and Nikabrik the dwarf, the Pevensie clan embarks on an incredible quest to ensure that Narnia is returned to its rightful heir.",/ust0K60AYegrKkE34ONo66r7Hfx.jpg,/qxz3WIyjZiSKUhaTIEJ3c1GcC9z.jpg
57201,The Lone Ranger,2013-07-03,"Action, Adventure, Western","The Texas Rangers chase down a gang of outlaws led by Butch Cavendish, but the gang ambushes the Rangers, seemingly killing them all. One survivor is found, however, by an American Indian named Tonto, who nurses him back to health. The Ranger, donning a mask and riding a white stallion named Silver, teams up with Tonto to bring the unscrupulous gang and others of that ilk to justice.",/esxoiZoDQydeyEX1tJcSbuigI3a.jpg,/p3OvQFa5lhbwSAhPygwnlugie1d.jpg
353486,Jumanji: Welcome to the Jungle,2017-12-09,"Adventure, Action, Comedy, Fantasy","The tables are turned as four teenagers are sucked into Jumanji's world - pitted against rhinos, black mambas and an endless variety of jungle traps and puzzles. To survive, they'll play as characters from the game.",/zJDMuXQDraHjtF53wikmyBQIcYe.jpg,/pSgXKPU5h6U89ipF7HBYajvYt7j.jpg
698201,Tokyo Revengers,2021-07-09,"Action, Drama",An unemployed man learns that his ex-girlfriend was murdered. He suddenly finds himself travelling through time to his middle school years and has chance to change the future and save the girl. He aims to rise to the top of the most brutal delinquent gang.,/ugOMsah4kTgB4mOQ4D9blh1oE9A.jpg,/aaOeNpdcpOJf6EcP99icwZXWbYC.jpg
609202,Black Fox,2019-10-05,"Animation, Action, Drama, Science Fiction",Rikka is a ninja descendant. Her grandfather Hyoe is the last chief of their ninja clan and her father is a cyborg researcher. Both are killed when a weapons' company raids his lab to use his research. Rikka sets out to avenge their deaths.,/4WbSBntySbZadKLWKHxNsf7sD14.jpg,/7ypOmAQ3TowBa4iBILBboOEQqYh.jpg
2300,Space Jam,1996-11-15,"Animation, Family, Comedy, Science Fiction","Jokes fly as the Tune Squad takes on the Nerdlucks in a hardcourt game to decide if the Looney Tunes remain here... or become attractions at a far-off galactic off-ramp called Moron Mountain. The Nerdlucks have a monstrous secret weapon: they've stolen the skills of top NBA stars like Charles Barkley and Patrick Ewing and become Monstars. But that's not all, folks. The Tune Squad’s secret weapon just happens to be the finest player in this or any other universe. He's outta this world. So's the fun.",/xIoWDHSA2ymOewcCpoUID4PpDb3.jpg,/4RN5El3Pj2W4gpwgiAGLVfSJv2g.jpg
58595,Snow White and the Huntsman,2012-05-30,"Adventure, Fantasy, Drama","After the Evil Queen marries the King, she performs a violent coup in which the King is murdered and his daughter, Snow White, is taken captive. Almost a decade later, a grown Snow White is still in the clutches of the Queen. In order to obtain immortality, The Evil Queen needs the heart of Snow White. After Snow escapes the castle, the Queen sends the Huntsman to find her in the Dark Forest.",/KBe9fHU5rVg4daoKnFwl1Cbc28.jpg,/8HUa5kRubYbnAD5UVpnhTGGgMTW.jpg
242582,Nightcrawler,2014-10-23,"Crime, Drama, Thriller","When Lou Bloom, desperate for work, muscles into the world of L.A. crime journalism, he blurs the line between observer and participant to become the star of his own story. Aiding him in his effort is Nina, a TV-news veteran.",/y4M5L9N2XVAajvLFj1UO3jz48Zg.jpg,/j9HrX8f7GbZQm1BrBiR40uFQZSb.jpg
213927,Born to Race: Fast Track,2014-03-20,Action,"Danny Krueger is a twenty-year old drag racer who plays by his own rules. After winning a scholarship to the prestigious Fast Lane Racing Academy, Danny finds himself competing against some of the fiercest young drivers in the world. Tension soars on and off the track, and a terrible incident leaves Danny without a racing partner. Facing dismissal from the academy, Danny is forced to team up with an old rival. The pair must learn to set aside their differences as they vie for rookie spots on a professional racing team.",/ruMaQrd2y7mGIzP39xESi8mglCH.jpg,/sYYQ9kS6Twvt0UcjxGLmBcq5k11.jpg
23827,Paranormal Activity,2007-09-14,"Horror, Mystery","After a young, middle-class couple moves into what seems like a typical suburban house, they become increasingly disturbed by a presence that may or may not be demonic but is certainly the most active in the middle of the night.  Followed by five terrifying installments in the franchise, this is the original found-footage shocker that started it all.",/hxFjtYQ1YuAAGeK13yHE2ylu5gM.jpg,/1bjA7de4O0NhMsaOqwvrecophUs.jpg
10202,Bedtime Stories,2008-12-24,"Fantasy, Comedy, Family, Romance",Skeeter Bronson is a down-on-his-luck guy who's always telling bedtime stories to his niece and nephew. But his life is turned upside down when the fantastical stories he makes up for entertainment inexplicably turn into reality. Can a bewildered Skeeter manage his own unruly fantasies now that the outrageous characters and situations from his mind have morphed into actual people and events?,/lrQtbANU5t61tNqZASVmQqgXasb.jpg,/d0w4anZCzZX74deeQ3PE1byyg97.jpg
567910,The Show,2021-08-26,"Drama, Fantasy, Mystery","A man goes on a mission to locate a stolen artifact for a client, which leads him to a haunted town full of vampires, sleeping beauties, and Voodoo gangsters.",/tX3PN76x4zRwZyYeNJI9uNXmkKz.jpg,/iZJ3IEJ5rvWgxbVbkAF4uU6ZIo.jpg
710871,Ghost Lab,2021-05-26,"Drama, Horror, Science Fiction, Thriller","After witnessing a haunting in their hospital, two doctors become dangerously obsessed with obtaining scientific proof that ghosts exist.",/mwfDVoJ5YIOeswfZARje1H6wSoj.jpg,/vdMsMYfkHJ6mLht5QCg7Hl8hnEp.jpg
14199,The Adventures of Sharkboy and Lavagirl,2005-06-10,"Adventure, Family, Science Fiction","Everyone always knew that Max had a wild imagination, but no one believed that his wildest creations -- a boy raised by watchful great white sharks and a girl with the force of a volcano -- were real. Now, these two pint-sized action masters will show Max that even an ordinary kid has what it takes to be extraordinary.",/lxhlZID5mspgUL6cirofkretS7k.jpg,/wyXPANZMYYbKh8Ic8qFLqMkolyV.jpg
100402,Captain America: The Winter Soldier,2014-03-20,"Action, Adventure, Science Fiction","After the cataclysmic events in New York with The Avengers, Steve Rogers, aka Captain America is living quietly in Washington, D.C. and trying to adjust to the modern world. But when a S.H.I.E.L.D. colleague comes under attack, Steve becomes embroiled in a web of intrigue that threatens to put the world at risk. Joining forces with the Black Widow, Captain America struggles to expose the ever-widening conspiracy while fighting off professional assassins sent to silence him at every turn. When the full scope of the villainous plot is revealed, Captain America and the Black Widow enlist the help of a new ally, the Falcon. However, they soon find themselves up against an unexpected and formidable enemy—the Winter Soldier.",/xOe8nHr5bpPvq4JbGy4vpttDwg2.jpg,/tVFRpFw3xTedgPGqxW0AOI8Qhh0.jpg
13002,Barbie in The 12 Dancing Princesses,2006-09-19,"Animation, Family","King Randolph sends for his cousin Duchess Rowena to help turn his daughters, Princess Genevieve and her 11 sisters, into better ladies. But the Duchess takes away all the sisters fun, including the sisters favorite pastime: dancing.Thinking all hope is lost they find a secret passageway to a magical land were they can dance the night away.",/8g6DICChiyJUHGc5ufn5kDaC6fd.jpg,/opxyzBkB44ubRRyhdrvkoUFWuIj.jpg
756278,Haunting of the Mary Celeste,2020-10-23,Horror,"Rachel, a concerned researcher, and her team have set out to sea to prove that the disappearance of a family and crew from a merchant ship was for reasons having to do with the supernatural. Her theory that those on the Mary Celeste vanished into a ""rift"" between dimensions proves true as the boat breaks down and her crew begins to vanish one by one.",/qtq1mai9POAX2IRGcxhVpf8f6Aj.jpg,/67ITWm7Me4ThtT7v3W9BYCcP2m.jpg
666624,Security,2021-06-07,Thriller,"After the assault of a young woman in their seaside town, a security expert and his family get caught in a powerful riptide of secrets and lies.",/syuRL8LkPz4HguGAxAwvUt3HWlK.jpg,/wLjN3vIw63GJ6m1J2fhGL3D2VXd.jpg
302699,Central Intelligence,2016-06-15,"Action, Comedy, Mystery, Crime","After he reunites with an old pal through Facebook, a mild-mannered accountant is lured into the world of international espionage.",/bp1axKtReP5qZsZU5i9tIiTkAQl.jpg,/7Ou0TRJLi72AwLEUlo7Kym4XuNB.jpg
82633,Lawless,2012-08-29,"Crime, Drama, Western","Set in the Depression-era Franklin County, Virginia, a bootlegging gang is threatened by authorities who want a cut of their profits.",/fEI7I233M9hkw1MRSBXEgauXhRl.jpg,/kmjy8rX4lY2x1UCJIH24VvUtDXJ.jpg
675490,The Unfamiliar,2020-08-21,"Thriller, Horror","A British Army doctor comes back from a war, thinking that she has PTSD only to discover that there is a more daunting malevolence at work making the life that she knew unfamiliar.",/h0IMyviDhX9QsRrhquuTejmjxPC.jpg,/Xt37loPwHjipC1qaCbfLfDcFu4.jpg
25565,Transformers: Beginnings,2006-10-16,"Action, Animation, Science Fiction, Thriller","On their home planet of Cybertron, the Autobots and Decepticons are involved in an explosive battle over the coveted AllSpark. With the fate of the universe at stake, the Autobots send it far from the reaches of the ruthless Megatron, leader of the Decepticons. But there are even more surprises in store when it crash-lands on Earth.",/nBwsJTcTE0LnaPAmFOECXTzEJwA.jpg,/q61s5H2DRHSJYx75adOtTL3aFuY.jpg
300671,13 Hours: The Secret Soldiers of Benghazi,2016-01-14,"War, Action, History, Thriller, Drama",An American Ambassador is killed during an attack at a U.S. compound in Libya as a security team struggles to make sense out of the chaos.,/ayDMYGUNVvXS76wQgFwTiUIDNb5.jpg,/4qnEeVPM8Yn5dIVC4k4yyjrUXeR.jpg
71552,American Reunion,2012-04-04,Comedy,"The characters we met a little more than a decade ago return to East Great Falls for their high-school reunion. In one long-overdue weekend, they will discover what has changed, who hasn’t, and that time and distance can’t break the bonds of friendship.",/8bVrMwYBAelHdjADUX833FWebNR.jpg,/ywH7WXgDusFz5hyRvD0oBNsufj2.jpg
8277,American Pie Presents: Beta House,2007-12-10,Comedy,"Erik, Ryan, and Cooze start college and pledge the Beta House fraternity, presided over by none other than legendary Dwight Stifler. But chaos ensues when a fraternity of geeks threatens to stop the debauchery and the Betas have to make a stand for their right to party.",/qSx994cBgJ2jgc5Gx4hc3QjtJP0.jpg,/cEJMqmCGdKJkmjWwi3Iv6l4kMIK.jpg
480530,Creed II,2018-11-21,Drama,"Between personal obligations and training for his next big fight against an opponent with ties to his family's past, Adonis Creed is up against the challenge of his life.",/9il7qNbeYnPMYlutsVYDsj4hRyb.jpg,/v3QyboWRoA4O9RbcsqH8tJMe8EB.jpg
428707,Kuroko's Basketball the Movie: Last Game,2017-03-18,Animation,"Shortly after the Inter-High of Kagami and Kuroko's second-year, a street basketball team from the USA called Team Jabberwock came to Japan to play a friendly match against a Japanese college-level street basketball team, Team Strky. Despite their best efforts, Strky is brutally crushed by Jabberwock. After the match, the Jabberwock players insult the players from Strky and all of Japanese basketball, claiming Strky's basketball was at the same level as monkeys and telling the players and crowds to quit playing basketball and kill themselves.  As a revenge match, Kagetora assembles a dream team of all members of Generation of Miracles plus Kuroko Tetsuya and Kagami Taiga, along with bench players Hyūga Junpei, Takao Kazunari, and Wakamatsu Kōsuke, forming Team Vorpal Swords, with the hopes of reclaiming the pride of Japanese basketball.",/4uutIFRibZTDFNsyhHK9kah7uzr.jpg,/c4qDRYVcqMKl6fdiCwfb3icHrUM.jpg
127585,X-Men: Days of Future Past,2014-05-15,"Action, Adventure, Fantasy, Science Fiction",The ultimate X-Men ensemble fights a war for the survival of the species across two time periods as they join forces with their younger selves in an epic battle that must change the past – to save our future.,/hUPgIibqZlwbhs4N08cPzzc4f5K.jpg,/9aq2sHfkkAFwH0wi4bZasXA8NbS.jpg
603692,John Wick: Chapter 4,2022-05-25,"Action, Crime, Thriller",null,,/kPsRQfoyYgcpbI6hvDQvUSCo0q3.jpg
128748,Curse of the Blair Witch,1999-07-11,"Documentary, Horror, Thriller","Curse of the Blair Witch is a documentary about the Blair Witch legend and the three filmmakers who disappeared in October of 1999. It first aired on the Sci-Fi Channel on July 11, 1999 as a promotional prelude to the release of The Blair Witch Project on July 30, 1999.",/7OlCmUwpJzJepUaOZ0n6oiCbNMP.jpg,/kTqRbjRIA6B1RbBaoLV098kwtXa.jpg
42246,Tom and Jerry: The Fast and the Furry,2005-10-11,"Family, Animation, Comedy, Action, Adventure","After being evicted from their old house by Tom's owner for causing major damage, cat and mouse Tom and Jerry enter a race entitled the ""Fabulous Super Race"" to win a mansion.",/bXILbW1i0WRShd6s4LfLKdJM6zm.jpg,/7PeNpz4mDyRqDxMhC0g0FCpVwPB.jpg
694,The Shining,1980-05-23,"Horror, Thriller","Jack Torrance accepts a caretaker job at the Overlook Hotel, where he, along with his wife Wendy and their son Danny, must live isolated from the rest of the world for the winter. But they aren't prepared for the madness that lurks within.",/2CrV8d8r8XcUW4SRjACFXoly1E8.jpg,/b6ko0IKC8MdYBBPkkA1aBPLe2yz.jpg
512195,Red Notice,2021-11-12,"Action, Comedy, Crime, Thriller","An Interpol-issued Red Notice is a global alert to hunt and capture the world's most wanted. But when a daring heist brings together the FBI's top profiler and two rival criminals, there's no telling what will happen.",/dK12GIdhGP6NPGFssK2Fh265jyr.jpg,/ArSmaJWhoOLHEK7avaYETXsiR2R.jpg
618416,Penguin Bloom,2021-01-21,Drama,"When an unlikely ally enters the Bloom family's world in the form of an injured baby magpie they name Penguin, the bird’s arrival makes a profound difference in the struggling family’s life.",/2dWWf6qjVU0TklCUKCUra1Yqfz3.jpg,/iUn7594Rwfstu5njA8hf9WQIcFi.jpg
604,The Matrix Reloaded,2003-05-15,"Adventure, Action, Thriller, Science Fiction","Six months after the events depicted in The Matrix, Neo has proved to be a good omen for the free humans, as more and more humans are being freed from the matrix and brought to Zion, the one and only stronghold of the Resistance.  Neo himself has discovered his superpowers including super speed, ability to see the codes of the things inside the matrix and a certain degree of pre-cognition. But a nasty piece of news hits the human resistance: 250,000 machine sentinels are digging to Zion and would reach them in 72 hours. As Zion prepares for the ultimate war, Neo, Morpheus and Trinity are advised by the Oracle to find the Keymaker who would help them reach the Source.  Meanwhile Neo's recurrent dreams depicting Trinity's death have got him worried and as if it was not enough, Agent Smith has somehow escaped deletion, has become more powerful than before and has fixed Neo as his next target.",/sDxCd4nt3eR4qOCW1GoD0RabQtq.jpg,/8xEVAe84zlL9rkfYT6dZXero4KK.jpg
571648,Beasts Clawing at Straws,2020-02-19,"Mystery, Thriller, Crime, Comedy, Drama","The destinies of hard-luck lowlifes slowly converge and come crashing down: Jung-man barely gets by working at a sauna and taking care of his sick mother until he finds a bag full of cash in the locker room; Tae-young is in trouble after his girlfriend runs away with the money he borrowed from a loan shark. Soon, a dead body mysteriously turns up; Mi-ran, caught between her husband’s violence and a dead-end job as a bar hostess, she finds a young lover, Jin-tae who offers to kill her husband… And now their dog-eat-dog game starts.",/1yqVaDR7uIA3Xx9GQIhbEbh5pEe.jpg,/lO4hjVBxrVtMmupGraIR3c7Jq1Q.jpg
49444,Kung Fu Panda 2,2011-05-25,"Animation, Family","Po is now living his dream as The Dragon Warrior, protecting the Valley of Peace alongside his friends and fellow kung fu masters, The Furious Five - Tigress, Crane, Mantis, Viper and Monkey. But Po’s new life of awesomeness is threatened by the emergence of a formidable villain, who plans to use a secret, unstoppable weapon to conquer China and destroy kung fu. It is up to Po and The Furious Five to journey across China to face this threat and vanquish it. But how can Po stop a weapon that can stop kung fu? He must look to his past and uncover the secrets of his mysterious origins; only then will he be able to unlock the strength he needs to succeed.",/7BdxZXbSkUiVeCRXKD3hi9KYeWm.jpg,/mtqqD00vB4PGRt20gWtGqFhrkd0.jpg
524251,I See You,2019-09-11,"Thriller, Mystery, Horror, Crime","When a 12-year-old boy goes missing, lead investigator Greg Harper struggles to balance the pressure of the investigation and troubles with his wife, Jackie. Facing a recent affair, great strain is put on the family that slowly gnaws away at Jackie's grip on reality. But after a malicious presence manifests itself in their home and puts their son, Connor, in mortal danger, the cold, hard truth about evil in the Harper household is finally uncovered.",/kkmTDENld0SASZVzqn25mbRYBzU.jpg,/E6mwyjpjvQISbUDYCTVg50rJyl.jpg
511987,Crawl,2019-07-11,"Thriller, Horror","When a huge hurricane hits her hometown in Florida, Haley ignores evacuation orders to look for her father. After finding him badly wounded, both are trapped by the flood. With virtually no time to escape the storm, they discover that rising water levels are the least of their problems.",/lm4xH0YwFbVvTgdtau1thNK5S6J.jpg,/mKxpYRIrCZLxZjNqpocJ2RdQW8v.jpg
169209,Empire State,2013-09-03,"Action, Drama","After failing to get into the police academy, Chris Potamitis settles for a security guard job with an armoured truck company. After he makes the mistake of mentioning the company's lax security to his best friend, He's unwittingly drawn into an elaborate scheme to rob the abundant amounts of cash being stored on their premises—resulting in the largest cash heist in U.S.history.",/9JOmd0KUfoAAUajJ7kcnbXeeSSl.jpg,/1LUmY5tqRzsqiYp0xrIZWwIRSuw.jpg
617653,The Last Duel,2021-10-13,"Drama, History",King Charles VI declares that Knight Jean de Carrouges settle his dispute with his squire by challenging him to a duel.,/4BOgSGwEEHZuDhiHUOsrXaJBqoc.jpg,/lDSLp0tjy5fYwYTRoLZzUxJ65w0.jpg
339984,Miracles from Heaven,2016-03-17,Drama,"When Christy discovers her 10-year-old daughter Anna has a rare, incurable disease, she becomes a ferocious advocate for her daughter’s healing as she searches for a solution. After Anna has a freak accident and falls three stories, a miracle unfolds in the wake of her dramatic rescue that leaves medical specialists mystified, her family restored and their community inspired.",/yOtnFqFFzA4z2G1i8zoTt5GRxpu.jpg,/hz9VF1TfaM0D04pYneSXUkNeOZv.jpg
8839,Casper,1995-05-26,"Fantasy, Comedy, Family","Casper is a kind young ghost who peacefully haunts a mansion in Maine. When specialist James Harvey arrives to communicate with Casper and his fellow spirits, he brings along his teenage daughter, Kat. Casper quickly falls in love with Kat, but their budding relationship is complicated not only by his transparent state, but also by his troublemaking apparition uncles and their mischievous antics.",/ejKwHgb6rowGfQtmR6NMqeToFVC.jpg,/2ah8fNJFZVU3vcXhU5xfAYi2eym.jpg
427641,Rampage,2018-04-12,Action,"Primatologist Davis Okoye shares an unshakable bond with George, the extraordinarily intelligent, silverback gorilla who has been in his care since birth.  But a rogue genetic experiment gone awry mutates this gentle ape into a raging creature of enormous size.  To make matters worse, it’s soon discovered there are other similarly altered animals.  As these newly created alpha predators tear across North America, destroying everything in their path, Okoye teams with a discredited genetic engineer to secure an antidote, fighting his way through an ever-changing battlefield, not only to halt a global catastrophe but to save the fearsome creature that was once his friend.",/wrqUiMXttHE4UBFMhLHlN601MZh.jpg,/MGADip4thVSErP34FAAfzFBTZ5.jpg
550,Fight Club,1999-10-15,Drama,"A ticking-time-bomb insomniac and a slippery soap salesman channel primal male aggression into a shocking new form of therapy. Their concept catches on, with underground ""fight clubs"" forming in every town, until an eccentric gets in the way and ignites an out-of-control spiral toward oblivion.",/fygeMr16EcxJiYhdiO1LEr7iHtI.jpg,/a26cQPRhJPX6GbWfQbvZdrrp9j9.jpg
76285,Percy Jackson: Sea of Monsters,2013-08-07,"Adventure, Family, Fantasy","In their quest to confront the ultimate evil, Percy and his friends battle swarms of mythical creatures to find the mythical Golden Fleece and to stop an ancient evil from rising.",/zkKKtYfvoGbK4yl4aPfLf65bUO8.jpg,/y4j0oCo6v6G3GKCumMjy4QdFlmR.jpg
43074,Ghostbusters,2016-07-14,"Action, Fantasy, Comedy","Following a ghost invasion of Manhattan, paranormal enthusiasts Erin Gilbert and Abby Yates, nuclear engineer Jillian Holtzmann, and subway worker Patty Tolan band together to stop the otherworldly threat.",/3RWsSQlqzRjsuqSRmoyggy74UA7.jpg,/wJmWliwXIgZOCCVOcGRBhce7xPS.jpg
343668,Kingsman: The Golden Circle,2017-09-20,"Action, Adventure, Comedy, Crime, Thriller","When an attack on the Kingsman headquarters takes place and a new villain rises, Eggsy and Merlin are forced to work together with the American agency known as the Statesman to save the world.",/eVHVwP71el20fofkCHo78ebQv7Q.jpg,/34xBL6BXNYFqtHO9zhcgoakS4aP.jpg
12153,White Chicks,2004-06-23,"Comedy, Crime","Two FBI agent brothers, Marcus and Kevin Copeland, accidentally foil a drug bust. As punishment, they are forced to escort a pair of socialites to the Hamptons, where they're going to be used as bait for a kidnapper. But when the girls realize the FBI's plan, they refuse to go. Left without options, Marcus and Kevin decide to pose as the sisters, transforming themselves from African-American men into a pair of blonde, white women.",/sQhpJhGj5gsQ8IeiVg0ZlCw9EPp.jpg,/vZoe1YoM8QDn1OwB7OrKHqrz3NT.jpg
601666,I Care a Lot,2021-02-19,"Comedy, Crime, Thriller",A court-appointed legal guardian defrauds her older clients and traps them under her care. But her latest mark comes with some unexpected baggage.,/vX5JtEcumMQvMCLVcIqfetc7hdg.jpg,/gKnhEsjNefpKnUdAkn7INzIFLSu.jpg
476968,"Paul, Apostle of Christ",2018-03-23,"Drama, History","Risking his life, Luke ventures to Rome to visit Paul -- the apostle who's bound in chains and held captive in Nero's darkest and bleakest prison cell. Haunted by the shadows of his past misdeeds, Paul wonders if he's been forgotten as he awaits his grisly execution. Before Paul's death, Luke resolves to write another book that details the birth of what will come to be known as the church.",/euAMcJLG26pW1kv4kPEtVEwwroQ.jpg,/2NUXG94dGMKYgJL1BkJGKynMb3l.jpg
147441,Exodus: Gods and Kings,2014-12-03,"Adventure, Drama, Action","The defiant leader Moses rises up against the Egyptian Pharaoh Ramses, setting 400,000 slaves on a monumental journey of escape from Egypt and its terrifying cycle of deadly plagues.",/lW4khyV5muPSs2BblMVnutnIjdw.jpg,/uaDj37JtvLan9tihxZ18e6qL33b.jpg
272,Batman Begins,2005-06-10,"Action, Crime, Drama","Driven by tragedy, billionaire Bruce Wayne dedicates his life to uncovering and defeating the corruption that plagues his home, Gotham City.  Unable to work within the system, he instead creates a new identity, a symbol of fear for the criminal underworld - The Batman.",/y9AuabF1SXnn3xZ0tAJLLhv33Uj.jpg,/8RW2runSEc34IwKN2D1aPcJd2UL.jpg
509967,6 Underground,2019-12-10,"Action, Thriller, Comedy","After faking his death, a tech billionaire recruits a team of international operatives for a bold and bloody mission to take down a brutal dictator.",/eFw5YSorHidsajLTayo1noueIxI.jpg,/lnWkyG3LLgbbrIEeyl5mK5VRFe4.jpg
615129,Pokémon Detective Pikachu 2,TBA,"Action, Adventure, Fantasy",Sequel to the 2019 film Pokémon Detective Pikachu,,/knr2XAbotEtc2X2diStLvv4ovPX.jpg
338762,Bloodshot,2020-03-05,"Action, Science Fiction","After he and his wife are murdered, marine Ray Garrison is resurrected by a team of scientists. Enhanced with nanotechnology, he becomes a superhuman, biotech killing machine—'Bloodshot'. As Ray first trains with fellow super-soldiers, he cannot recall anything from his former life. But when his memories flood back and he remembers the man that killed both him and his wife, he breaks out of the facility to get revenge, only to discover that there's more to the conspiracy than he thought.",/zlqMASc3vEtdym2OvXgE7fC6onT.jpg,/8WUVHemHFH2ZIP6NWkwlHWsyrEL.jpg
10679,Iron Sky,2012-03-10,"Action, Comedy, Science Fiction","In the last moments of World War II, a secret Nazi space program evaded destruction by fleeing to the Dark Side of the Moon. During 70 years of utter secrecy, the Nazis construct a gigantic space fortress with a massive armada of flying saucers.",/tQh2Hx0lvapK1CEQUsm5TFtF2vw.jpg,/hVDJM29BSbET4FzI24xLuWSmDUR.jpg
350640,Clean Sex,2015-07-19,Comedy,Mariana has an obsessive cleaning habit. After starting a troubled relationship with Enrique. She must accept that sex is dirty and  impulsive.,,/57zuiN6e8D82p15HsHV9JxwKxhJ.jpg
13053,Bolt,2008-11-21,"Animation, Family, Adventure, Comedy","Bolt is the star of the biggest show in Hollywood. The only problem is, he thinks it's real. After he's accidentally shipped to New York City and separated from Penny, his beloved co-star and owner, Bolt must harness all his ""super powers"" to find a way home.",/4j1whLohGyuz24yIUB9vjwnIFR4.jpg,/z9VHoUcZ1GiH3f3qYz7Me7Zc1Fd.jpg
